id,abstract,authorships.author.display_name,authorships.institutions.display_name,cited_by_count,title,doi,fwci,is_retracted,language,is_oa,oa_status,primary_location.source.display_name,primary_location.source.type,publication_date,type
https://openalex.org/W4385828216,"Scene graph generation (SGG) has been developed to detect objects and their relationships from the visual data and has attracted increasing attention in recent years. Existing works have focused on extracting object context for SGG. However, very few works have attempted to exploit implicit contextual correlations among relationships of the objects. Furthermore, most existing SGG schemes rely on high-level features to predict the predicates while overlooking the potential inherent association of low-level features with the object relationships. We present in this article a novel scheme to capture enhanced contextual information for both objects and relationships. We design a Dual-branch Context Analysis Transformer (DCAT) architecture to extract both object context and relationship context from the visual data with dual transformer branches and then effectively fuse both high-level and low-level features by an adaptive approach to facilitate relationship prediction. Specifically, we first conduct feature representation learning to enrich relation representations by the visual, spatial, and linguistic feature extractors. Next, two transformer branches are designed to leverage the modeling of global associative interaction and mine the hidden association among objects and relationships. Then, we devise a novel feature disentangling method to decouple contextualized high-level features with guidance from the visual semantics. Finally, we develop a refined attention module to perform low-level feature recalibration for the refinement of the final predicate prediction. Experiments on Visual Genome and Action Genome datasets demonstrate the effectiveness of DCAT for both image and video SGG settings. Moreover, we also test the quality of the generated image scene graphs to verify the generalizability on downstream tasks like sentence-to-graph retrieval and image retrieval.",Shiqi Sun|Danlan Huang|Xiaoming Tao|Chengkang Pan|Guangyi Liu|Chang Wen Chen,Tsinghua University|Beijing University of Posts and Telecommunications|Tsinghua University|China Mobile (China)|China Mobile (China)|Hong Kong Polytechnic University,3,Boosting Scene Graph Generation with Contextual Information,https://doi.org/10.1145/3615868,0.54590502,FALSE,en,TRUE,hybrid,ACM Transactions on Multimedia Computing Communications and Applications,journal,2023-08-15,article
https://openalex.org/W4386071201,,Zhiming Wang|Yuxiao Li|Danlan Huang|Juan Wang|Ning Ge|Jianhua Lu,National Engineering Research Center for Information Technology in Agriculture|Tsinghua University|Tsinghua University|National Engineering Research Center for Information Technology in Agriculture|Tsinghua University|Institute of Automation|Chinese Academy of Sciences|Tsinghua University|National Engineering Research Center for Information Technology in Agriculture|Tsinghua University|National Engineering Research Center for Information Technology in Agriculture,3,DeformSg2im: Scene graph based multi-instance image generation with a deformable geometric layout,https://doi.org/10.1016/j.neucom.2023.126684,0.54590502,FALSE,en,FALSE,closed,Neurocomputing,journal,2023-08-22,article
https://openalex.org/W4386090265,,Jianhao Lv|Rong Zhang|Xinyu Li|Shimin Liu|Tianyuan Liu|Qi Zhang|Jinsong Bao,Donghua University|Donghua University|Donghua University|Hong Kong Polytechnic University|Hong Kong Polytechnic University|Donghua University|Donghua University,9,A Multimodality Scene Graph Generation Approach for Robust Human–Robot Collaborative Assembly Visual Relationship Representation,https://doi.org/10.1109/tii.2023.3303964,1.63771506,FALSE,en,FALSE,closed,IEEE Transactions on Industrial Informatics,journal,2023-08-23,article
https://openalex.org/W4388137869,"Modern man today is very dependent on his life with computers. Because with the help of computer technology can ease their task. A computer can create a situation similar to the original. This technology is commonly called simulation. Serious simulations depict a system that is difficult to perform in the real world and is at high risk. These serious simulations are usually much more developed in the making. This development technology is called Virtual Reality (VR). Virtual Reality (VR) is a development of stereo display techniques. Where users can see an object with dimensional depth that will give a 3D effect on the human brain. Based on the background above, the author tries to implement stereo displays in firefighting simulation (FFS) applications. The simulation engine used is Open Scene Graph with Microsoft Visual Studio 2008 compiler, which uses the C++ programming language. The GUI display design uses Qt 4.7.3. Users will try the stereo display effect in the FFS application and interact between the fire particle system and the water particle system to compare factors that cause fire particle system outages. Of all the implementations and trials carried out, the author succeeded in implementing stereoscopic fire suppression simulation applications. Because all objects in this application already have a red shadow for the left side of the thing and a blue shadow for the right side. The interaction between the user and the fire suppression simulation application was also successfully displayed in this Fire Fighting Simulation (FFS) application. The fire particle system will be extinguished if the user performs fire suppression interactions.",Windarko Windarko,Universitas Atma Jaya Makassar,1,Fire Suppression Simulation Application Development Stereo Graphics Based (Virtual Reality),https://doi.org/10.58812/wsist.v1i01.260,0.61848763,FALSE,en,TRUE,diamond,West Science Information System and Technology,journal,2023-08-28,article
https://openalex.org/W4392412489,,Zhirui Wang|Xinlong Jiang|Chenlong Gao|Yiqiang Chen,Chinese Academy of Sciences|University of Chinese Academy of Sciences|Institute of Computing Technology|University of Chinese Academy of Sciences|Institute of Computing Technology|Chinese Academy of Sciences|Institute of Computing Technology|Chinese Academy of Sciences|University of Chinese Academy of Sciences|Institute of Computing Technology|University of Chinese Academy of Sciences|Chinese Academy of Sciences,0,Interactive Scene-driven Multi-stream Graph Neural Network for ADHD Diagnosis,https://doi.org/10.1109/swc57546.2023.10448928,0.0,FALSE,en,FALSE,closed,,,2023-08-28,article
https://openalex.org/W4386231006,,Xinxin Liu|Yuchen Zhou|Chao Gou,Sun Yat-sen University|Sun Yat-sen University|Sun Yat-sen University,27,Learning From Interaction-Enhanced Scene Graph for Pedestrian Collision Risk Assessment,https://doi.org/10.1109/tiv.2023.3309274,7.44756427,FALSE,en,FALSE,closed,IEEE Transactions on Intelligent Vehicles,journal,2023-08-28,article
https://openalex.org/W4386936529,"In this paper, we propose a novel 3D scene graph generation model, L3DSG, which can make use of rich prior knowledge obtained from large language model (LLM) by prompt engineering. The proposed model is built upon our previous 3D scene graph generation model, C3DSG, that adopts Point Transformer as 3D geometric feature extractor and uses the NE-GAT graph neural network as context reasoner. The new proposed model addresses the inability of C3DSG to utilize prior knowledge on indoor physical environments. It focuses on issues of how to obtain prior knowledge from LLM and how to make use of it for predicting objects and their relations effectively. The proposed model is extended from C3DSG by adding several elaborate modules to prompt, encode, and fuse prior knowledge from LLM. Through various experiments using the benchmark dataset 3DSSG, we show the superiority of the proposed model.",Ho-Jun Baek|Incheol Kim,,0,3D Scene Graph Generation Using Prior Knowledge from Large Language Model (LLM),https://doi.org/10.9717/kmms.2023.26.8.859,0.0,FALSE,en,TRUE,diamond,Journal of Korea Multimedia Society,journal,2023-08-31,article
https://openalex.org/W4386307233,"A rapidly expanding multimedia environment in recent years has led to an explosive increase in demand for multimodality that can communicate with humans in various ways. Even though the convergence of vision and language intelligence has shed light on the remarkable success over the last few years, there is still a caveat: it is unknown whether they truly understand the semantics of the image. More specifically, how they correctly capture relationships between objects represented within the image is still regarded as a black box. In order to testify whether such relationships are well understood, this work mainly focuses on the Graph-structured visual Question Answering (GQA) task which evaluates the understanding of an image by reasoning a scene graph describing the structural characteristics of an image in the form of natural language together with the image. Unlike the existing approaches that have been accompanied by an additional encoder for scene graphs, we propose a simple yet effective framework using pre-trained multimodal transformers for scene graph reasoning. Inspired by the fact that a scene graph can be regarded as a set of sentences describing two related objects with a relationship, we fuse them into the framework separately from the question. In addition, we propose a multi-task learning method that utilizes evaluating the grammatical validity of questions as an auxiliary task to better understand a question with complex structures. This utilizes the semantic role labels of the question to randomly shuffle the sentence structure of the question. We have conducted extensive experiments to evaluate the effectiveness in terms of task capabilities, ablation studies, and generalization.",Yoonseok Heo|Sangwoo Kang,Sogang University|Gachon University,1,A Simple Framework for Scene Graph Reasoning with Semantic Understanding of Complex Sentence Structure,https://doi.org/10.3390/math11173751,0.18196834,FALSE,en,TRUE,gold,Mathematics,journal,2023-08-31,article
https://openalex.org/W4387546385,,Chenxing Li|Yiping Duan|Qiyuan Du|Shiqi Sun|Xin Deng|Xiaoming Tao,Tsinghua University|Tsinghua University|Tsinghua University|Tsinghua University|Beihang University|Tsinghua University,4,VR+HD: Video Semantic Reconstruction From Spatio-Temporal Scene Graphs,https://doi.org/10.1109/jstsp.2023.3323654,0.72787336,FALSE,en,FALSE,closed,IEEE Journal of Selected Topics in Signal Processing,journal,2023-09-01,article
https://openalex.org/W4386590339,,Shiqi Sun|Danlan Huang|Zhijin Qin|Xiaoming Tao|Chengkang Pan|Guangyi Liu,National Engineering Research Center for Information Technology in Agriculture|Tsinghua University|Beijing University of Posts and Telecommunications|Tsinghua University|Tsinghua University|China Mobile (China)|China Mobile (China),0,USGG: Union Message Based Scene Graph Generation,https://doi.org/10.1109/icip49359.2023.10222408,0.0,FALSE,en,FALSE,closed,,,2023-09-11,article
https://openalex.org/W4386869667,,Zi Qin Liew|Minrui Xu|Wei Yang Bryan Lim|Zehui Xiong|Dusit Niyato|Dong In Kim,|Nanyang Technological University|Nanyang Technological University|Singapore University of Technology and Design|Nanyang Technological University|Sungkyunkwan University,15,Mechanism Design for Semantic Communication in UAV-Assisted Metaverse: A Combinatorial Auction Approach,https://doi.org/10.1109/tvt.2023.3317069,6.59328438,FALSE,en,FALSE,closed,IEEE Transactions on Vehicular Technology,journal,2023-09-19,article
https://openalex.org/W4386961215,"The Simultaneous Localization and Mapping (SLAM) method is widely used in the positioning and mapping of robots. In the medical field, SLAM is used in auxiliary medical robots and surgical robots. In endoscopic surgery, SLAM performs endoscopic positioning and scene graph construction for the surgical environment based on the information collected by the endoscope. For research on endoscopic SLAM, this article will first introduce the application of SLAM in endoscopic surgery in recent years. This paper summarizes the innovations and future work of relevant literature in recent years and identifies existing problems in SLAM in endoscopic surgery. Next, this article will introduce the combination of deep learning and SLAM in endoscopic surgery and list some specific applications. Finally, this paper will give a prospect for the future application of SLAM in endoscopic surgery. The research in this paper will be of great value to applying SLAM in endoscopic surgery and conducive to the development of future endoscopic SLAM.",Zheng Zhang,Harbin Institute of Technology,1,Research on endoscopic surgery based on SLAM,https://doi.org/10.54254/2755-2721/12/20230296,0.51995027,FALSE,en,TRUE,hybrid,Applied and Computational Engineering,journal,2023-09-22,article
https://openalex.org/W4387827795,"Scene-graph-based Visual Question Answering (VQA) has emerged as a burgeoning field in Deep Learning research, with a growing demand for robust and interpretable VQA systems. In this paper, we present a novel visual analysis approach that addresses two critical objectives in VQA: identifying and correcting prediction issues and providing insights into model decision-making processes through visualizing internal information. Our approach builds on the GraphVQA framework, which uses graph neural networks to process scene graphs representing images and which was trained on the widely-used GQA dataset. Our analysis tool aims at users familiar with the basics of graph-based VQA. By leveraging query-based scene analysis and visualization of crucial internal states, we are able to detect and pinpoint reasons for inaccurate predictions, facilitating model refinement and dataset curation. Identifying expressive internal states is a challenge. Through rigorous computer-based evaluations and presentation of a use case, we demonstrate the effectiveness of our analysis tool and model state visualization.",Noel Schäfer|Sebastian Künzel|Tanja Munz|Pascal Tilli|Sandeep Vidyapu|Ngoc Thang Vu|Daniel Weiskopf,University of Stuttgart|University of Stuttgart|University of Stuttgart|University of Stuttgart|University of Stuttgart|University of Stuttgart|University of Stuttgart,1,Visual Analysis of Scene-Graph-Based Visual Question Answering,https://doi.org/10.1145/3615522.3615547,0.18196834,FALSE,en,TRUE,gold,,,2023-09-22,article
https://openalex.org/W4391768674,,Yongwei Li|Tao Song|Xinkai Wu,Beihang University|Beihang University|Beihang University,4,Robust Construction of Spatial-Temporal Scene Graph Considering Perception Failures for Autonomous Driving,https://doi.org/10.1109/itsc57777.2023.10422096,0.65424479,FALSE,en,FALSE,closed,,,2023-09-24,article
https://openalex.org/W4387029683,,Ho-Jun Baek|Incheol Kim,,0,C3DSG: A 3D Scene Graph Generation Model Using Point Clouds of Indoor Environment,https://doi.org/10.5626/jok.2023.50.9.758,0.0,FALSE,en,FALSE,closed,Journal of KIISE,journal,2023-09-25,article
https://openalex.org/W4387092463,,Zhenghao Wang|Jing Lian|Linhui Li|Jian Zhao,Dalian University of Technology|Dalian University of Technology|Dalian University of Technology|Dalian University of Technology,4,A Novel Framework for Scene Graph Generation via Prior Knowledge,https://doi.org/10.1109/tcsvt.2023.3319633,0.72787336,FALSE,en,FALSE,closed,IEEE Transactions on Circuits and Systems for Video Technology,journal,2023-09-27,article
https://openalex.org/W4387127047,"In modeling vision, there has been a remarkable progress in recognizing a range of scene components, but the problem of analyzing full scenes, an ultimate goal of visual perception, is still largely open. To deal with complete scenes, recent work focused on the training of models for extracting the full graph-like structure of a scene. In contrast with scene graphs, humans’ scene perception focuses on selected structures in the scene, starting with a limited interpretation and evolving sequentially in a goal-directed manner [G. L. Malcolm, I. I. A. Groen, C. I. Baker, Trends. Cogn. Sci. 20 , 843–856 (2016)]. Guidance is crucial throughout scene interpretation since the extraction of full scene representation is often infeasible. Here, we present a model that performs human-like guided scene interpretation, using an iterative bottom–up, top–down processing, in a “counterstream” structure motivated by cortical circuitry. The process proceeds by the sequential application of top–down instructions that guide the interpretation process. The results show how scene structures of interest to the viewer are extracted by an automatically selected sequence of top–down instructions. The model shows two further benefits. One is an inherent capability to deal well with the problem of combinatorial generalization—generalizing broadly to unseen scene configurations, which is limited in current network models [B. Lake, M. Baroni, 35th International Conference on Machine Learning, ICML 2018 (2018)]. The second is the ability to combine visual with nonvisual information at each cycle of the interpretation process, which is a key aspect for modeling human perception as well as advancing AI vision systems.",Shimon Ullman|Liav Assif|Alona Strugatski|Ben-Zion Vatashsky|Hila Levi|Aviv Netanyahu|Adam Yaari,Weizmann Institute of Science|Weizmann Institute of Science|Weizmann Institute of Science|Weizmann Institute of Science|Weizmann Institute of Science|Massachusetts Institute of Technology|Massachusetts Institute of Technology,3,Human-like scene interpretation by a guided counterstream processing,https://doi.org/10.1073/pnas.2211179120,0.54590502,FALSE,en,TRUE,hybrid,Proceedings of the National Academy of Sciences,journal,2023-09-28,article
https://openalex.org/W4390873597,,Kunal Pratap Singh|Jordi Salvador|Luca Weihs|Aniruddha Kembhavi,Allen Institute|Allen Institute|Allen Institute|Allen Institute,14,Scene Graph Contrastive Learning for Embodied Navigation,https://doi.org/10.1109/iccv51070.2023.00999,2.54755676,FALSE,en,FALSE,closed,,,2023-10-01,article
https://openalex.org/W4390190087,"We propose a new task, non localized scene graph verification, whose objective is to provide a justified expression of inconsistencies between the visual content of the image and its non-localized scene graph in order to diagnose errors or anticipate corrections. We introduce a sequential algorithm capable of detecting and proposing plausible corrections, taking into account the information already present in the scene graph and exploiting knowledge priors. Instead of relying on object detection that requires bounding box annotations, we use a simple visual question answering (VQA) as a proxy for visual content analysis. We show on the VG150 dataset that our strategy is efficient compared to a baseline adapted from a caption editing approach. We also show that our algorithm is able to efficiently correct corrupted scene graphs.",Dao Thauvin|Stéphane Herbin,Université Paris-Saclay|Office National d'Études et de Recherches Aérospatiales|Université Paris-Saclay|Office National d'Études et de Recherches Aérospatiales,2,Knowledge Informed Sequential Scene Graph Verification Using VQA,https://doi.org/10.1109/iccvw60793.2023.00009,0.36393668,FALSE,en,TRUE,green,,,2023-10-02,article
https://openalex.org/W4387500623,,Huihui Li|Baorong Liu|Dongqing Wu|Hang Liu|Lei Guo,Northwestern Polytechnical University|Northwestern Polytechnical University|Northwestern Polytechnical University|Northwestern Polytechnical University|Northwestern Polytechnical University,0,Bel: Batch Equalization Loss for scene graph generation,https://doi.org/10.1007/s10044-023-01199-z,0.0,FALSE,en,FALSE,closed,Pattern Analysis and Applications,journal,2023-10-10,article
https://openalex.org/W4387564020,,Ege Özsoy|Tobias Czempiel|Evin Pınar Örnek|Ulrich Eck|Federico Tombari|Nassir Navab,Technical University of Munich|Technical University of Munich|Technical University of Munich|Technical University of Munich|Google (Switzerland)|Technical University of Munich|Technical University of Munich,14,Holistic OR domain modeling: a semantic scene graph approach,https://doi.org/10.1007/s11548-023-03022-w,7.05229843,FALSE,en,TRUE,hybrid,International Journal of Computer Assisted Radiology and Surgery,journal,2023-10-12,article
https://openalex.org/W4388855749,,Shan Yang|Ruofan Wang|Lijin Fang|Chule Yang|Yi Yang|Yufeng Yue,Beijing Institute of Technology|China Academy of Launch Vehicle Technology|Beijing Institute of Technology|Academy of Military Medical Sciences|Beijing Institute of Technology|Beijing Institute of Technology,0,Bidirectional Edge-Based 3D Scene Graph Generation from Point Clouds,https://doi.org/10.1109/icus58632.2023.10318268,0.0,FALSE,en,FALSE,closed,,,2023-10-13,article
https://openalex.org/W4388757893,,Jessica D’Souza|P. K. Aleema|Shayanashree. N Dhanyashree|Clita Fernandes|K. Kavitha|Chandra Naik,,2,Knowledge-Based Scene Graph Generation in Medical Field,https://doi.org/10.1109/discover58830.2023.10316715,0.36393668,FALSE,en,FALSE,closed,,,2023-10-13,article
https://openalex.org/W4387698267,"Scene graph generation (SGG) methods have suffered from a severe training bias towards frequent (head) predicate classes. Recent works owe it to the long-tailed distribution of predicates and alleviate the long-tailed problem to conduct de-biasing. However, the ""unbiased'' models are in turn biased to tail predicate classes, resulting in a significant performance loss on head predicate classes. The main cause of such a trade-off between head and tail predicates is the fact that multiple predicates from the head or tail ones can be labeled as the ground-truth. To this end, we propose a multi-expert de-biasing method (MED) for SGG that can produce unbiased scene graphs with minor influence on recognizing head predicates. We avoid the dilemma of balancing between head and tail predicates by adaptively classifying the predicates with multiple complementary models. Experiments on the Visual Genome dataset show that MED provides significant gains on mRecall@K without harming the performance on Recall@K, and achieves a state-of-the-art on the mean of Recall@K and mRecall@K.",Xuezhi Tong|Rui Wang|Lihua Jing,Tianjin University|Chinese Academy of Sciences|Institute of Information Engineering|Chinese Academy of Sciences|Institute of Information Engineering,0,Alleviating Training Bias with Less Cost via Multi-expert De-biasing Method in Scene Graph Generation,https://doi.org/10.1145/3607541.3616816,0.0,FALSE,en,TRUE,gold,,,2023-10-17,article
https://openalex.org/W4387698214,"Recent works on Scene Graph Generation (SGG) have been concentrating on solving the problem of long-tailed distribution. While these methods are making significant improvements on the tail predicate categories, they sacrifice the performance of the head ones severely. The major issue lies in the semantic ambiguity problem, which is the contradiction between the commonly used criterion and the nature of relationships in the SGG datasets. The models are evaluated with graph constraint, which allows merely one relationship between a pair of objects. However, the relationships are much more complex and can always be described from different views. For example, when a man is in front of a computer, we can also say he is watching it. Both options are plausible, describing the different aspects of the relationship. Which of them is determined to be the ground-truth is highly subjective. In this paper, we claim that the relationships should be considered from multiple views to avoid the semantic ambiguity. In other words, the model should provide all the possibilities, rather than being biased to any one of the options. To this end, we propose the Multi-View Predicate Recognition (MVPR), which separates the label set into multiple views and enables the model to represent and predict in a ""multi-view'' style. Specifically, MVPR can be divided into three parts: Adaptive Bounding Box for Predicate is proposed to help the model attend to the crucial areas for the predicate categories in different views; Multi-View Predicate Feature Learning is designed to separate the feature space of different views of predicate categories; Multi-View Predicate Prediction and Multi-View Graph Constraint are used to allow the model to provide multi-view predictions to accurately estimate ambiguous relationships. Experimental results on the Visual Genome dataset show that our MVPR can significantly improve the model performance on the SGG task, and achieves a new state-of-the-art.",Xuezhi Tong|Lihua Jing|C.L. Zou|Rui Wang,Tianjin University|Institute of Information Engineering|Chinese Academy of Sciences|Chinese Academy of Sciences|Institute of Information Engineering|Chinese Academy of Sciences|Institute of Information Engineering,0,Multi-View Predicate Recognition for Solving Semantic Ambiguity Problem in Scene Graph Generation,https://doi.org/10.1145/3607541.3616817,0.0,FALSE,en,TRUE,gold,,,2023-10-17,article
https://openalex.org/W4387885774,,Jian Cheng|Kaifang Long|Shuang Zhang|Tian Zhang|Lianbo Ma|Shi Cheng|Yinan Guo,China Coal Research Institute (China)|Northeastern University|Northeastern University|Northeastern University|Northeastern University|Shaanxi Normal University|China University of Mining and Technology,7,Text-Image Scene Graph Fusion for Multimodal Named Entity Recognition,https://doi.org/10.1109/tai.2023.3326416,1.27377838,FALSE,en,FALSE,closed,IEEE Transactions on Artificial Intelligence,journal,2023-10-23,article
