id,abstract,authorships.author.display_name,authorships.institutions.display_name,cited_by_count,title,doi,fwci,is_retracted,language,is_oa,oa_status,primary_location.source.display_name,primary_location.source.type,publication_date,type
https://openalex.org/W3195129957,"Visual question answering (VQA) is a challenging problem in machine perception, which requires a deep joint understanding of both visual and textual data. Recent research has advanced the automatic generation of high-quality scene graphs from images, while powerful yet elegant models like graph neural networks (GNNs) have shown great power in reasoning over graph-structured data. In this work, we propose to bridge the gap between scene graph generation and VQA by leveraging GNNs. In particular, we design a new model called Conditional Enhanced Graph ATtention network (CE-GAT) to encode pairs of visual and semantic scene graphs with both node and edge features, which is seamlessly integrated with a textual question encoder to generate answers through question-graph conditioning. Moreover, to alleviate the training difficulties of CE-GAT towards VQA, we enforce more useful inductive biases in the scene graphs through novel question-guided graph enriching and pruning. Finally, we evaluate the framework on one of the largest available VQA datasets (namely, GQA) with ground-truth scene graphs, achieving the accuracy of 77.87%, compared with the state of the art (namely, the neural state machine (NSM)), which gives 63.17%. Notably, by leveraging existing scene graphs, our framework is much lighter compared with end-to-end VQA methods (e.g., about 95.3% less parameters than a typical NSM).",Sai Vidyaranya Nuthalapati|Ramraj Chandradevan|Eleonora Giunchiglia|Bowen Li|Maxime Kayser|Thomas Lukasiewicz|Carl Yang,University of Oxford|Emory University|University of Oxford|University of Oxford|University of Oxford|University of Oxford|Emory University,20,Lightweight Visual Question Answering using Scene Graphs,https://doi.org/10.1145/3459637.3482218,1.53329218,FALSE,en,TRUE,gold,,,2021-10-26,article
https://openalex.org/W4200046362,,Yuming Sun|Hangyu Lin|Chen Liu|Yanwei Fu,Fudan University|Fudan University|University of Hong Kong|Fudan University,1,Learning Depth Information in Layout for Sketch Generation from Scene Graph,https://doi.org/10.1109/bigdia53151.2021.9619707,0.10221948,FALSE,en,FALSE,closed,,,2021-10-29,article
https://openalex.org/W3213646606,,Aiswarya S. Kumar|Jyothisha J. Nair,Amrita Vishwa Vidyapeetham|Amrita Vishwa Vidyapeetham,1,A novel SPLIT-SIM approach for efficient image retrieval,https://doi.org/10.1007/s00530-021-00864-9,0.10221948,FALSE,en,FALSE,closed,Multimedia Systems,journal,2021-11-08,article
https://openalex.org/W4205119235,"The animation construction of forest scene is a virtual stand scene visualization framework which uses the related technologies of virtual forest modeling and stand scene visualization, and uses the scene graph technology to manage. This paper studies the influence of digital media technology on the animation design of forest scene. In this paper, the model of virtual stand scene is mainly completed by Creator modeling software of MultiGen company. In order to reduce the number of scene patches and ensure realism, the tree model is designed with OpenFlight tree hierarchy. At the same time, the key technologies of Creator modeling and model optimization are analyzed. The virtual stand scene visualization framework uses the open source graphics rendering engine OpenSceneGraph (OSG) as the scene driver to realize the stand scene visualization. This paper provides a variety of roaming control methods. The experimental results show that the virtual forest scene visualization framework can better simulate the forest scene and has a strong sense of reality.",Lu Yu,Henan Polytechnic University,1,Influence of Digital Media Technology on Forest Scene Animation Design,https://doi.org/10.17762/jfcr.vi.184,0.0,FALSE,en,TRUE,bronze,Forest Chemicals Review,journal,2021-11-16,article
https://openalex.org/W3217281196,,Jie Lin|Yi Cai|Xin Wu|Jianwei Lu,South China University of Technology|South China University of Technology|South China University of Technology|South China University of Technology,6,Graph-Based Information Block Detection in Infographic With Gestalt Organization Principles,https://doi.org/10.1109/tvcg.2021.3130071,0.40887792,FALSE,en,FALSE,closed,IEEE Transactions on Visualization and Computer Graphics,journal,2021-11-23,article
https://openalex.org/W4250643848,,Bowen Zhao|Zhendong Mao|Shancheng Fang|Wenyu Zang|Yongdong Zhang,University of Science and Technology of China|University of Science and Technology of China|University of Science and Technology of China|Institute of Information Engineering|China Electronics Corporation (China)|Chinese Academy of Sciences|University of Science and Technology of China,17,Semantically Similarity-Wise Dual-Branch Network for Scene Graph Generation,https://doi.org/10.1109/tcsvt.2021.3130197,1.12441427,FALSE,en,FALSE,closed,IEEE Transactions on Circuits and Systems for Video Technology,journal,2021-11-23,article
https://openalex.org/W4200341733,,Xuan Hou|Huailin Zhao,Shanghai Institute of Technology|Shanghai Institute of Technology,0,Edge-cloud Collaborative Architecture for Scene Graph Application System,https://doi.org/10.1109/iciibms52876.2021.9651576,0.0,FALSE,en,FALSE,closed,,,2021-11-25,article
https://openalex.org/W4321383586,,Todor Stojanovski,KTH Royal Institute of Technology,5,Urban morphology and artificial intelligence,https://doi.org/10.51347/um26.0005,0.25864281,FALSE,en,FALSE,closed,Urban Morphology,journal,2021-11-28,article
https://openalex.org/W4210369563,,Zhiming Wang|Yuxiao Li|Danlan Huang|Yantian Luo|Ning Ge|Jianhua Lu,National Engineering Research Center for Information Technology in Agriculture|Tsinghua University|National Engineering Research Center for Information Technology in Agriculture|Tsinghua University|Tsinghua University|National Engineering Research Center for Information Technology in Agriculture|National Engineering Research Center for Information Technology in Agriculture|Tsinghua University|Tsinghua University|National Engineering Research Center for Information Technology in Agriculture|National Engineering Research Center for Information Technology in Agriculture|Tsinghua University,5,Deformable Geometry based Semantic Reconstruction from Scene Graphs,https://doi.org/10.1109/globecom46510.2021.9685640,0.19003548,FALSE,en,FALSE,closed,2021 IEEE Global Communications Conference (GLOBECOM),conference,2021-12-01,article
https://openalex.org/W4205393926,,Chao Zhang|Ignas Budvytis|Stephan Liwicki|Roberto Cipolla,Toshiba (United Kingdom)|University of Cambridge|Toshiba (United Kingdom)|University of Cambridge|Toshiba (United Kingdom),3,Lifted Semantic Graph Embedding for Omnidirectional Place Recognition,https://doi.org/10.1109/3dv53792.2021.00147,1.28293791,FALSE,en,FALSE,closed,2021 International Conference on 3D Vision (3DV),conference,2021-12-01,article
https://openalex.org/W4200013588,,Tian Zheng|Wenhua Qian|Rencan Nie|Jinde Cao|Dan Xu,Yunnan University|Yunnan University|Yunnan University|Yonsei University|Southeast University|Yunnan University,0,Graph Structural Attention and Increased Global Attention for Image Captioning,https://doi.org/10.1109/icicip53388.2021.9642211,0.0,FALSE,en,FALSE,closed,,,2021-12-03,article
https://openalex.org/W3214135126,,Minghao Xu|Meng Qu|Bingbing Ni|Jian Tang,Shanghai Jiao Tong University||Shanghai Jiao Tong University|HEC Montréal,5,Joint Modeling of Visual Objects and Relations for Scene Graph Generation,,3.14748201,FALSE,en,FALSE,closed,Neural Information Processing Systems,conference,2021-12-06,article
https://openalex.org/W3213320466,,Shoulong Zhang|Shuai Li|Aimin Hao|Hong Qin,"Beihang University|Beihang University|Beihang University|University at Albany, State University of New York|Albany State University",16,Knowledge-inspired 3D Scene Graph Prediction in Point Cloud,,5.7860327,FALSE,en,FALSE,closed,Neural Information Processing Systems,conference,2021-12-06,article
https://openalex.org/W4206837865,,Chuxue Cao|Yiming He|Yuzhen Chen|Chunli Song|Hao Ling|Renchu Guan|Xiaoyue Feng,Jilin University|Jilin University|Jilin University|Second Affiliated Hospital of Jilin University|Second Affiliated Hospital of Jilin University|Jilin University|Jilin University,0,Medical Scene Graphs and Reasoning,https://doi.org/10.1109/bibm52615.2021.9669882,0.0,FALSE,en,FALSE,closed,2021 IEEE International Conference on Bioinformatics and Biomedicine (BIBM),conference,2021-12-09,article
https://openalex.org/W4210632034,,Elham Alighardash|Hassan Khotanlou|Vahid Pour Amin,Bu-Ali Sina University|Bu-Ali Sina University|,1,Conceptual Intelligent Model for Visual Question Answering Using Attention Mechanism and Relational Reasoning,https://doi.org/10.1109/ikt54664.2021.9685682,0.10221948,FALSE,en,FALSE,closed,,,2021-12-14,article
https://openalex.org/W4200464318,,Ga Young Jung|Incheol Kim,,0,Dynamic 3D Scene Graph Generation for Robotic Manipulation Tasks,https://doi.org/10.5302/j.icros.2021.21.0140,0.0,FALSE,en,FALSE,closed,Journal of Institute of Control Robotics and Systems,journal,2021-12-15,article
https://openalex.org/W4200261572,,Ping Li|Yu Zhou|Yibing Zhan,Hangzhou Dianzi University|Hangzhou Dianzi University|Jingdong (China)|Hangzhou Dianzi University,6,Deep relational self-Attention networks for scene graph generation,https://doi.org/10.1016/j.patrec.2021.12.013,0.51109739,FALSE,en,FALSE,closed,Pattern Recognition Letters,journal,2021-12-24,article
https://openalex.org/W4205395137,"To understand an image or a scene properly, it is necessary to identify objects participating in the scene, their relationships, and various attributes that describe their properties. A scene graph is a high-level representation that confines all these features in a structured manner. Scene graph generation includes multiple challenges like the semantics of relationships considered and the availability of a well-balanced dataset with sufficient training examples. We tried to mitigate these problems by extracting two subsets, VG-R10 and VG-A16, from the popular Visual Genome dataset. Also, a framework (S2G) is proposed for generating scene graphs directly from images using depth and spatial information of object pairs. Evaluations on the scene graph generation model reveal that the proposed framework achieves better results on our data than the state-of-the-art.",Aiswarya S. Kumar|Jyothisha J. Nair,Amrita Vishwa Vidyapeetham|Amrita Vishwa Vidyapeetham,9,"Scene Graph Generation Using Depth, Spatial, and Visual Cues in 2D Images",https://doi.org/10.1109/access.2021.3139000,0.71553635,FALSE,en,TRUE,gold,IEEE Access,journal,2021-12-27,article
https://openalex.org/W4313011309,"Many learning activities include working with graph data, which offers a wealth of relational information between parts.Modeling physical systems, learning molecular fingerprints, predicting protein interfaces, and diagnosing illnesses all need the use of a model that can learn from graph inputs.In other fields, such as learning from non-structural data such as texts and images, reasoning on extracted structures (such as phrase dependency trees and image scene graphs) is a major topic that requires graph reasoning models.Graph neural networks (GNNs) are neural models that use message transmission between graph nodes to represent graph dependency.Variants of GNNs have recently showed ground-breaking performance on a variety of deep learning tasks.This paper represents a review of the literature on Knowledge Graphs and Graph Neural Networks, with a particular focus on Graph Embeddings and Graph Neural Networks applications as a powerful tool for organizing structured data and making sense of unstructured data, which can be applied to a variety of real-world problems.",Elda Xhumari|Suela Maxhelaku|Endri Xhina,University of Tirana||,0,A REVIEW OF KNOWLEDGE GRAPH AND GRAPH NEURAL NETWORK APPLICATION,https://doi.org/10.20472/efc.2022.016.015,0.0,FALSE,en,TRUE,gold,,,2022-01-01,review
https://openalex.org/W4312390192,,Ryogo Yamamoto|Tota ISHIKAWA|Mitsuki Yoshida|Wakayama Kazuki|Tanaka Kanji,University of Fukui|University of Fukui|University of Fukui|University of Fukui|University of Fukui,0,Active SLAM: Place Classification and Viewpoint Planning from Domain-Invariant Scene Graphs,https://doi.org/10.1299/jsmermd.2022.2p1-h10,0.0,FALSE,en,FALSE,closed,The Proceedings of JSME annual Conference on Robotics and Mechatronics (Robomec),journal,2022-01-01,article
https://openalex.org/W4312435765,,Kanglong Fan|Wei Liu|Xiaowen Chen|Bharath Ramesh|Cheng Xiang,National University of Singapore|National University of Singapore|National University of Singapore|Western Sydney University|National University of Singapore,0,An Interpretable Scene Understanding Framework Via Graph Learning,https://doi.org/10.2139/ssrn.4238333,,FALSE,en,TRUE,green,SSRN Electronic Journal,repository,2022-01-01,article
https://openalex.org/W4291653579,,Hao Zhou|Jun Zhang|Tingjin Luo|Yazhou Yang|Jun Lei,National University of Defense Technology|Naval University of Engineering|National University of Defense Technology|National University of Defense Technology|National University of Defense Technology|National University of Defense Technology,10,Debiased Scene Graph Generation for Dual Imbalance Learning,https://doi.org/10.1109/tpami.2022.3198965,1.23791801,FALSE,en,FALSE,closed,IEEE Transactions on Pattern Analysis and Machine Intelligence,journal,2022-01-01,article
https://openalex.org/W4226020578,"The goal of scene graph generation (SGG) is to classify objects and their pair-wise relationships in a visual scene. Object occlusion is a critical challenge when generating scene graphs in complex scenes. However, this issue has rarely been explored in recent works. Accordingly, in this paper, we propose a subset matching network (SM-Net) that handles the above problem. First, we decompose SGG into two types of subset matching problems: node subset matching and edge subset matching. Each node/edge subset handles the occlusion between one node/edge pair, thereby reducing the difficulty of SGG in a &#x201C;divide and conquer&#x201D; manner. Second, we introduce a node subset prediction module that utilizes a subset-based message passing module to refine the node subset representation and a matching loss to supervise node subset prediction. Third, we propose an edge subset prediction module that applies a feature selection-based fusion function to obtain edge subset features and a matching loss to supervise edge subset predictions. Experiments on three popular datasets show that our model achieves state-of-the-art performance. The code of SM-Net will be released.",Xin Lin|Jinquan Zeng|Xingquan Li,South China University of Technology|South China University of Technology|Shenzhen Institute of Information Technology,3,Divide and Conquer: Subset Matching for Scene Graph Generation in Complex Scenes,https://doi.org/10.1109/access.2022.3165617,0.3713754,FALSE,en,TRUE,gold,IEEE Access,journal,2022-01-01,article
https://openalex.org/W4287887959,"Jianguo Mao, Wenbin Jiang, Xiangdong Wang, Zhifan Feng, Yajuan Lyu, Hong Liu, Yong Zhu. Proceedings of the 2022 Conference of the North American Chapter of the Association for Computational Linguistics: Human Language Technologies. 2022.",Jianguo Mao|Wenbin Jiang|Xiangdong Wang|Zhifan Feng|Yajuan Lyu|Hong Liu|Zhu Yong,Institute of Computing Technology|Chinese Academy of Sciences|University of Chinese Academy of Sciences|Baidu (China)|Chinese Academy of Sciences|Institute of Computing Technology|Baidu (China)|Baidu (China)|Institute of Computing Technology|Chinese Academy of Sciences|Baidu (China),6,Dynamic Multistep Reasoning based on Video Scene Graph for Video Question Answering,https://doi.org/10.18653/v1/2022.naacl-main.286,0.41426553,FALSE,en,TRUE,hybrid,Proceedings of the 2022 Conference of the North American Chapter of the Association for Computational Linguistics: Human Language Technologies,conference,2022-01-01,article
https://openalex.org/W4285265289,"Human-robot collaboration (HRC) plays a crucial role in agile, flexible, and human-centric manufacturing towards the mass personalization transition. Nevertheless, in today's HRC tasks, either humans or robots need to follow the partners' commands and instructions along collaborative activities progressing, instead of proactive, mutual engagement. The non-semantic perception of HRC scenarios impedes mutually needed, proactive planning and high-cognitive capabilities in existing HRC systems. To overcome the bottleneck, this research explores a dynamic scene graph-based method for mutual-cognition generation in Proactive HRC applications. Firstly, a spatial-attention object detector is utilized to dynamically perceive objects in industrial settings. Secondly, a linking prediction module is leveraged to construct HRC scene graphs. An attentional graph convolutional network (GCN) is utilized to capture relations between industrial parts, human operators, and robot operations and reason structural connections of human-robot collaborative processing as graph embedding, which links to mutual planners for human operation supports and robot proactive instructions. Lastly, the Proactive HRC implementation is demonstrated on disassembly tasks of aging electronic vehicle batteries (EVBs) and evaluate its mutual-cognition capabilities.",Shufei Li|Pai Zheng|Zuoxu Wang|Junming Fan|Lihui Wang,Hong Kong Polytechnic University|Hong Kong Polytechnic University|Beihang University|Hong Kong Polytechnic University|KTH Royal Institute of Technology,15,Dynamic Scene Graph for Mutual-Cognition Generation in Proactive Human-Robot Collaboration,https://doi.org/10.1016/j.procir.2022.05.089,2.37845625,FALSE,en,TRUE,diamond,Procedia CIRP,journal,2022-01-01,article
https://openalex.org/W4286830653,"The task of generating sequence images from paragraphs by generating confrontation networks can already generate higher quality images.However,when the input text involves multiple objects and relationships,the context information of the text sequence is difficult to extract,the object layout of the generated image is prone to confusion,and the generated object details are insufficient.To solve this problem,this paper proposes a method of generating sequence images based on scene graphs based on StoryGAN.First,the paragraph is converted into multiple scene graphs through graph convolution,each scene graph contains the object and relationship information of the corresponding text.Then,the bounding box and segmentation mask of the object are predicted to calculate the scene layout.Finally,according to the scene layout and the context information,a sequence of images more in line with the object and its relationship is generated.Tests on CLEVR-SV and CoDraw-SV data sets show that the me-thod in this paper can generate 64&times;64-pixel sequence images containing multiple objects and their relationships.Experimental results show that on the CLEVR-SV data set,the SSIM and FID of this method are improved by 1.34% and 9.49% respectively than StoryGAN.On the CoDraw-SV data set,the ACC of this method is 7.40% higher than that of StoryGAN.The proposed method improves the rationality of the layout of the generated scene,not only can generate an image sequence containing multiple objects and relationships,but also the generated image has higher quality and clearer details.",TANG Yi-feng ZHANG Wei-qi,Suzhou University of Science and Technology|Suzhou Institute of Trade & Commerce,0,Image Stream From Paragraph Method Based on Scene Graph,https://doi.org/10.11896/jsjkx.201100207,0.0,FALSE,en,TRUE,green,SHILAP Revista de lepidopterología,journal,2022-01-01,article
https://openalex.org/W4287854977,"In this work, we propose the application of abstract meaning representation (AMR) based semantic parsing models to parse textual descriptions of a visual scene into scene graphs, which is the first work to the best of our knowledge. Previous works examined scene graph parsing from textual descriptions using dependency parsing and left the AMR parsing approach as future work since sophisticated methods are required to apply AMR. Hence, we use pre-trained AMR parsing models to parse the region descriptions of visual scenes (i.e. images) into AMR graphs and pre-trained language models (PLM), BART and T5, to parse AMR graphs into scene graphs. The experimental results show that our approach explicitly captures high-level semantics from textual descriptions of visual scenes, such as objects, attributes of objects, and relationships between objects. Our textual scene graph parsing approach outperforms the previous state-of-the-art results by 9.3% in the SPICE metric score.",Woo Suk Choi|Yu‐Jung Heo|Dharani Punithan|Byoung‐Tak Zhang,|Seoul National University|Seoul National University|Seoul National University,7,Scene Graph Parsing via Abstract Meaning Representation in Pre-trained Language Models,https://doi.org/10.18653/v1/2022.dlg4nlp-1.4,0.86654261,FALSE,en,TRUE,gold,,,2022-01-01,article
https://openalex.org/W4312295020,,Tomoya OTA|Ryogo Yamamoto|Honoka OKUGUCHI|Yudai MORISHITA|Hiroki Tomoe|Tanaka Kanji,University of Fukui|University of Fukui|University of Fukui|University of Fukui|University of Fukui|University of Fukui,0,Scene graph representation robust against graph errors for scene graph classification,https://doi.org/10.1299/jsmermd.2022.2p1-h11,0.0,FALSE,en,FALSE,closed,The Proceedings of JSME annual Conference on Robotics and Mechatronics (Robomec),journal,2022-01-01,article
https://openalex.org/W4312240915,"Applications such as providing a preview of personal albums (e.g., Google Photos) or suggesting thematic collections based on user interests (e.g., Pinterest) require a semantically-enriched image representation, which should be more informative with respect to simple low-level visual features and image tags. To this aim, we propose an image collection summarization technique based on frequent subgraph mining. We represent images with a novel type of scene graphs including fine-grained relationship types between objects. These scene graphs are automatically derived by our method. The resulting summary consists of a set of frequent subgraphs describing the underlying patterns of the image dataset. Our results are interpretable and provide more powerful semantic information with respect to previous techniques, in which the summary is a subset of the collection in terms of images or image patches. The experimental evaluation shows that the proposed technique yields non-redundant summaries, with a high diversity of the discovered patterns.",Andrea Pasini|Flavio Giobergia|Eliana Pastor|Elena Baralis,Polytechnic University of Turin|Polytechnic University of Turin|Polytechnic University of Turin|Polytechnic University of Turin,6,Semantic Image Collection Summarization With Frequent Subgraph Mining,https://doi.org/10.1109/access.2022.3229654,0.74275081,FALSE,en,TRUE,gold,IEEE Access,journal,2022-01-01,article
https://openalex.org/W4285151875,,Zhiyuan Lin|Feng Zhu|Yanzi Kong|Qun Wang|Jianyu Wang,Chinese Academy of Sciences|Shenyang Institute of Automation|University of Chinese Academy of Sciences|Chinese Academy of Sciences|Shenyang Institute of Automation|Chinese Academy of Sciences|University of Chinese Academy of Sciences|Shenyang Institute of Automation|Shenyang Institute of Automation|University of Chinese Academy of Sciences|Chinese Academy of Sciences|Northeastern University|Shenyang Institute of Automation|Chinese Academy of Sciences,11,SRSG and S2SG: A Model and a Dataset for Scene Graph Generation of Remote Sensing Images From Segmentation Results,https://doi.org/10.1109/tgrs.2022.3185678,1.23791801,FALSE,en,FALSE,closed,IEEE Transactions on Geoscience and Remote Sensing,journal,2022-01-01,article
https://openalex.org/W4288768562,,Bo Sun|Yong Wu|Jun He|Lejun Yu,,0,Structured Coding Based on Semantic Disambiguation for Video Captioning,https://doi.org/10.2139/ssrn.4174916,,FALSE,en,TRUE,green,SSRN Electronic Journal,repository,2022-01-01,article
