id,abstract,authorships.author.display_name,authorships.institutions.display_name,cited_by_count,title,doi,fwci,is_retracted,language,is_oa,oa_status,primary_location.source.display_name,primary_location.source.type,publication_date,type
https://openalex.org/W2250378130,"Semantically complex queries which include attributes of objects and relations between objects still pose a major challenge to image retrieval systems.Recent work in computer vision has shown that a graph-based semantic representation called a scene graph is an effective representation for very detailed image descriptions and for complex queries for retrieval.In this paper, we show that scene graphs can be effectively created automatically from a natural language scene description.We present a rule-based and a classifierbased scene graph parser whose output can be used for image retrieval.We show that including relations and attributes in the query graph outperforms a model that only considers objects and that using the output of our parsers is almost as effective as using human-constructed scene graphs (Recall@10 of 27.1% vs. 33.4%).Additionally, we demonstrate the general usefulness of parsing to scene graphs by showing that the output can also be used to generate 3D scenes.",Sebastian Schuster|Ranjay Krishna|Anne Lynn S. Chang|Li Fei-Fei|Christopher D. Manning,Stanford University|Stanford University|Stanford University|Stanford University|Stanford University,352,Generating Semantically Precise Scene Graphs from Textual Descriptions for Improved Image Retrieval,https://doi.org/10.18653/v1/w15-2812,11.89798758,FALSE,en,TRUE,gold,,,2015-01-01,article
https://openalex.org/W2077069816,,Justin Johnson|Ranjay Krishna|Michael Stark|Li-Jia Li|David A. Shamma|Michael S. Bernstein|Li Fei-Fei,Stanford University|Stanford University|Max Planck Institute for Informatics|Yahoo (United States)|Snap (United States)|Yahoo (United States)|Stanford University|Stanford University,1093,Image retrieval using scene graphs,https://doi.org/10.1109/cvpr.2015.7298990,37.57259236,FALSE,en,FALSE,closed,,,2015-06-01,article
https://openalex.org/W2201056710,,Satoshi Ikehata|Hang Yang|Yasutaka Furukawa,Washington University in St. Louis|Washington University in St. Louis|Washington University in St. Louis,153,Structured Indoor Modeling,https://doi.org/10.1109/iccv.2015.156,10.01935796,FALSE,en,FALSE,closed,,,2015-12-01,article
https://openalex.org/W2576665611,,Zhiqiang Sui|Lingzhu Xiang|Odest Chadwicke Jenkins|Karthik Desingh,University of Michigan–Ann Arbor|University of Toronto|Institute for Christian Studies|University of Michigan–Ann Arbor|University of Michigan–Ann Arbor,35,Goal-directed robot manipulation through axiomatic scene estimation,https://doi.org/10.1177/0278364916683444,3.59686679,FALSE,en,FALSE,closed,The International Journal of Robotics Research,journal,2017-01-01,article
https://openalex.org/W2763231886,,Fei Fang|Miao Yi|Hui Feng|Shenghong Hu|Chunxia Xiao,Wuhan University|Wuhan University|Wuhan University|Wuhan University|Wuhan University,17,Narrative Collage of Image Collections by Scene Graph Recombination,https://doi.org/10.1109/tvcg.2017.2759265,0.63555111,FALSE,en,FALSE,closed,IEEE Transactions on Visualization and Computer Graphics,journal,2017-10-04,article
https://openalex.org/W2790781626,,Xinru Wei|Yonggang Qi|Jun Liu|Fang Liu,Beijing University of Posts and Telecommunications|Beijing University of Posts and Telecommunications|Beijing University of Posts and Telecommunications|Beijing University of Posts and Telecommunications,14,Image retrieval by dense caption reasoning,https://doi.org/10.1109/vcip.2017.8305157,0.50844089,FALSE,en,FALSE,closed,,,2017-12-01,article
https://openalex.org/W2958256323,"In modern industrial environments, human-robot collaboration is a trend in automation to improve performance and productivity. Instead of isolating robot from human to guarantee safety, collaborative robotics allows human and robot working in the same area at the same time. New hazards and risks, such as the collision between robot and human, arise in this situation. Safety analysis is necessary to protect both human and robot when using a collaborative robot.To perform safety analysis, robots need to perceive the surrounding environment in realtime. This surrounding environment is perceived and stored in the form of scene graph, which is a direct graph with semantic representation of the environment, the relationship between the detected objects and properties of these objects. In order to generate the scene graph, a simulated warehouse is used: robots and humans work in a common area for transferring products between shelves and conveyor belts. Each robot generates its own scene graph from the attached camera sensor. In the graph, each detected object is represented by a node and edges are used to denote the relationship among the identified objects. The graph node includes values like velocity, bounding box sizes, orientation, distance and directions between the object and the robot.We generate scene graph in a simulated warehouse scenario with the frequency of 7 Hz and present a study of Mask R-CNN based on the qualitative comparison. Mask R-CNN is a method for object instance segmentation to get the properties of the objects. It uses ResNetFPN for feature extraction and adds a branch to Faster R-CNN for predicting segmentation mask for each object. And its results outperform almost all existing, single-model entries on instance segmentation and bounding-box object detection. With the help of this method, the boundaries of the detected object are extracted from the camera images. We initialize Mask R-CNN model using three different types of weights: COCO pre-trained weight, ImageNet pre-trained weight and random weight, and the results of these three different weights are compared w.r.t. precision and recall.Results showed that Mask R-CNN is also suitable for simulated environments and can meet requirements in both detection precision and speed. Moreover, the model trained used the COCO pre-trained weight outperformed the model with ImageNet and randomly assigned initial weights. The calculated Mean Average Precision (mAP) value for validation dataset reaches 0.949 with COCO pre-trained weights and execution speed of 11.35 fps.",Shaolei Wang,,0,Scene Recognition for Safety Analysis in Collaborative Robotics,,0.0,FALSE,en,TRUE,green,KTH Publication Database DiVA (KTH Royal Institute of Technology),repository,2018-01-01,article
https://openalex.org/W2893908566,"We present a new methodology to teach spatial augmented reality in a practical assignment to large audiences. Our approach does not require specific equipment such as video projectors while teaching the principal topics and difficulties involved in spatial augmented reality applications, and especially calibration and tracking. The key idea is to set up a scene graph consisting of a 3D scene with a simulated projector that ""projects"" content onto a virtual representation of the real-world object. For illustrating the calibration, we simplify the intrinsic parameters to using the field of view, both for the camera and the projector. For illustrating the tracking, instead of relying on specific hardware or software, we exploit the relative transformations in the scene graph. We implemented our teaching methodology in Unity3D and tested it within a three-hour assignment to 24 and 20 master-level students in two consecutive years. We show the positive feedback that we received and discuss our plans for further improvement.",Brett Ridel|Patrick Reuter|Nadine Couture,Laboratoire Bordelais de Recherche en Informatique|École Supérieure des Technologies Industrielles Avancées|École Supérieure des Technologies Industrielles Avancées,1,Teaching Spatial Augmented Reality: a Practical Assignment for Large Audiences,https://doi.org/10.2312/eged.20181004,,FALSE,en,TRUE,gold,,,2018-01-01,preprint
https://openalex.org/W2828129428,,Taliesin L. Smith|Jesse Greenberg|Sam Reid|Emily B. Moore,University of Colorado Boulder|University of Colorado Boulder|University of Colorado Boulder|University of Colorado Boulder,11,Parallel DOM Architecture for Accessible Interactive Simulations,https://doi.org/10.1145/3192714.3192817,2.7482865,FALSE,en,FALSE,closed,,,2018-04-23,article
https://openalex.org/W2804009377,,Rui Li|Xiaodong Zhang|Hanzhe Li|Liming Zhang|Zhufeng Lu|Jiangcheng Chen,Xi'an Jiaotong University|Xi'an Jiaotong University|Xi'an Jiaotong University|Xi'an Jiaotong University|Xi'an Jiaotong University|University of Hong Kong,19,An approach for brain-controlled prostheses based on Scene Graph Steady-State Visual Evoked Potentials,https://doi.org/10.1016/j.brainres.2018.05.018,1.88217262,FALSE,en,FALSE,closed,Brain Research,journal,2018-05-16,article
https://openalex.org/W2889569452,,Jikai Wang|Zonghai Chen,University of Science and Technology of China|University of Science and Technology of China,15,A Novel Hybrid Map Based Global Path Planning Method,https://doi.org/10.1109/acirs.2018.8467225,1.15506032,FALSE,en,FALSE,closed,,,2018-07-01,article
https://openalex.org/W2808399177,"This paper focuses on scene graph completion which aims at predicting new relations between two entities utilizing existing scene graphs and images. By comparing with the well-known knowledge graph, we first identify that each scene graph is associated with an image and each entity of a visual triple in a scene graph is composed of its entity type with attributes and grounded with a bounding box in its corresponding image. We then propose an end-to-end model named Representation Learning via Jointly Structural and Visual Embedding (RLSV) to take advantages of structural and visual information in scene graphs. In RLSV model, we provide a fully-convolutional module to extract the visual embeddings of a visual triple and apply hierarchical projection to combine the structural and visual embeddings of a visual triple. In experiments, we evaluate our model on two scene graph completion tasks: link prediction and visual triple classification, and further analyze by case studies. Experimental results demonstrate that our model outperforms all baselines in both tasks, which justifies the significance of combining structural and visual information for scene graph completion.",Hai Wan|Yonghao Luo|Bo Peng|Wei‐Shi Zheng,China Guangzhou Analysis and Testing Center|Sun Yat-sen University|Sun Yat-sen University|Sun Yat-sen University|Sun Yat-sen University,33,Representation Learning for Scene Graph Completion via Jointly Structural and Visual Embedding,https://doi.org/10.24963/ijcai.2018/132,4.3683741,FALSE,en,TRUE,gold,,,2018-07-01,article
https://openalex.org/W2899483913,,Rafia Inam|Klaus Raizer|Alberto Hata|Ricardo Gabbay de Souza|Elena Forsman|Enyu Cao|Shaolei Wang,Ericsson (Sweden)|Ericsson (Sweden)|Ericsson (Sweden)|Ericsson (Sweden)|Ericsson (Sweden)|KTH Royal Institute of Technology|KTH Royal Institute of Technology,67,Risk Assessment for Human-Robot Collaboration in an automated warehouse scenario,https://doi.org/10.1109/etfa.2018.8502466,2.66908417,FALSE,en,FALSE,closed,,,2018-09-01,article
https://openalex.org/W2910766642,"We introduce UNDERWORLDS, a novel lightweight framework for cascading spatio-temporal situation assessment in robotics. UNDERWORLDS allows programmers to represent the robot's environment as real-time distributed data structures, containing both scene graphs (for representation of 3D geometries) and timelines (for representation of temporal events). UNDERWORLDS supports cascading representations: the environment is viewed as a set of worlds that can each have different spatial and temporal granularities, and may inherit from each other. UNDERWORLDS also provides a set of high-level client libraries and tools to introspect and manipulate the environment models.\n\nThis article presents the design and architecture of this open-source tool, and explores some applications, along with examples of use.",Séverin Lemaignan|Yoan Sallami|Christopher D. Wallbridge|Aurélie Clodic|Tony Belpaeme|Rachid Alami,University of the West of England|Bristol Robotics Laboratory|Laboratoire d'Analyse et d'Architecture des Systèmes|Centre National de la Recherche Scientifique|Université Fédérale de Toulouse Midi-Pyrénées|University of Plymouth|Centre National de la Recherche Scientifique|Université Fédérale de Toulouse Midi-Pyrénées|Laboratoire d'Analyse et d'Architecture des Systèmes|University of Plymouth|Université Fédérale de Toulouse Midi-Pyrénées|Laboratoire d'Analyse et d'Architecture des Systèmes|Centre National de la Recherche Scientifique,15,UNDERWORLDS: Cascading Situation Assessment for Robots,https://doi.org/10.1109/iros.2018.8594094,4.12435992,FALSE,en,TRUE,green,,,2018-10-01,preprint
https://openalex.org/W2907562548,,Valber Lemes Zacarkim|Eduardo Todt|Felipe Gustavo Bombardelli,Universidade Federal do Paraná|Universidade Federal do Paraná|Universidade Federal do Paraná,2,Evaluation of IGFTT Keypoints Detector in Indoor Visual SLAM,https://doi.org/10.1109/lars/sbr/wre.2018.00025,0.37494181,FALSE,en,FALSE,closed,,,2018-11-01,article
https://openalex.org/W2903754102,,Lars Kunze|Tom Bruls|Tarlan Suleymanov|Paul Newman,University of Oxford|University of Oxford|University of Oxford|University of Oxford,36,Reading between the Lanes: Road Layout Reconstruction from Partially Segmented Scenes,https://doi.org/10.1109/itsc.2018.8569270,3.51500443,FALSE,en,FALSE,closed,,,2018-11-01,article
https://openalex.org/W2902539442,"We introduce a novel framework for using natural language to generate and edit 3D indoor scenes, harnessing scene semantics and text-scene grounding knowledge learned from large annotated 3D scene databases. The advantage of natural language editing interfaces is strongest when performing semantic operations at the sub-scene level, acting on groups of objects. We learn how to manipulate these sub-scenes by analyzing existing 3D scenes. We perform edits by first parsing a natural language command from the user and transforming it into a semantic scene graph that is used to retrieve corresponding sub-scenes from the databases that match the command. We then augment this retrieved sub-scene by incorporating other objects that may be implied by the scene context. Finally, a new 3D scene is synthesized by aligning the augmented sub-scene with the user's current scene, where new objects are spliced into the environment, possibly triggering appropriate adjustments to the existing scene arrangement. A suggestive modeling interface with multiple interpretations of user commands is used to alleviate ambiguities in natural language. We conduct studies comparing our approach against both prior text-to-scene work and artist-made scenes and find that our method significantly outperforms prior work and is comparable to handmade scenes even when complex and varied natural sentences are used.",Rui Ma|Akshay Gadi Patil|Matthew Fisher|Manyi Li|Sören Pirk|Binh‐Son Hua|Sai-Kit Yeung|Xin Tong|Leonidas Guibas|Hao Zhang,|Simon Fraser University|Adobe Systems (United States)|Shandong University|Simon Fraser University|Stanford University|The University of Tokyo|Hong Kong University of Science and Technology|University of Hong Kong|Microsoft Research Asia (China)|Stanford University|Simon Fraser University,94,Language-driven synthesis of 3D scenes from scene databases,https://doi.org/10.1145/3272127.3275035,5.4865365,FALSE,en,TRUE,bronze,ACM Transactions on Graphics,journal,2018-11-28,article
https://openalex.org/W2965288565,"We propose Scene Graph Auto-Encoder (SGAE) that incorporates the language inductive bias into the encoder-decoder image captioning framework for more human-like captions. Intuitively, we humans use the inductive bias to compose collocations and contextual inference in discourse. For example, when we see the relation `person on bike', it is natural to replace `on' with `ride' and infer `person riding bike on a road' even the `road' is not evident. Therefore, exploiting such bias as a language prior is expected to help the conventional encoder-decoder models less likely overfit to the dataset bias and focus on reasoning. Specifically, we use the scene graph --- a directed graph ($\mathcal{G}$) where an object node is connected by adjective nodes and relationship nodes --- to represent the complex structural layout of both image ($\mathcal{I}$) and sentence ($\mathcal{S}$). In the textual domain, we use SGAE to learn a dictionary ($\mathcal{D}$) that helps to reconstruct sentences in the $\mathcal{S}\rightarrow \mathcal{G} \rightarrow \mathcal{D} \rightarrow \mathcal{S}$ pipeline, where $\mathcal{D}$ encodes the desired language prior; in the vision-language domain, we use the shared $\mathcal{D}$ to guide the encoder-decoder in the $\mathcal{I}\rightarrow \mathcal{G}\rightarrow \mathcal{D} \rightarrow \mathcal{S}$ pipeline. Thanks to the scene graph representation and shared dictionary, the inductive bias is transferred across domains in principle. We validate the effectiveness of SGAE on the challenging MS-COCO image captioning benchmark, e.g., our SGAE-based single-model achieves a new state-of-the-art $127.8$ CIDEr-D on the Karpathy split, and a competitive $125.5$ CIDEr-D (c40) on the official server even compared to other ensemble models.",Xu Yang|Kaihua Tang|Hanwang Zhang|Jianfei Cai,,2,Auto-Encoding Graphical Inductive Bias for Descriptive Image Captioning,,0.28876508,FALSE,en,TRUE,green,arXiv (Cornell University),repository,2018-12-06,article
https://openalex.org/W2902899766,"Scene graphs -- objects as nodes and visual relationships as edges -- describe the whereabouts and interactions of the things and stuff in an image for comprehensive scene understanding. To generate coherent scene graphs, almost all existing methods exploit the fruitful visual context by modeling message passing among objects, fitting the dynamic nature of reasoning with visual context, eg, person on bike can help to determine the relationship ride, which in turn contributes to the category confidence of the two objects. However, we argue that the scene dynamics is not properly learned by using the prevailing cross-entropy based supervised learning paradigm, which is not sensitive to graph inconsistency: errors at the hub or non-hub nodes are unfortunately penalized equally. To this end, we propose a Counterfactual critic Multi-Agent Training (CMAT) approach to resolve the mismatch. CMAT is a multi-agent policy gradient method that frames objects as cooperative agents, and then directly maximizes a graph-level metric as the reward. In particular, to assign the reward properly to each agent, CMAT uses a counterfactual baseline that disentangles the agent-specific reward by fixing the dynamics of other agents. Extensive validations on the challenging Visual Genome benchmark show that CMAT achieves a state-of-the-art by significant performance gains under various settings and metrics.",Long Chen|Hanwang Zhang|Jun Xiao|Xiangnan He|Shiliang Pu|Shih-Fu Chang,,12,Scene Dynamics: Counterfactual Critic Multi-Agent Training for Scene Graph Generation.,,1.58820793,FALSE,en,TRUE,green,arXiv (Cornell University),repository,2018-12-06,article
https://openalex.org/W2904763822,"Generation of scene graphs and natural language captions from images for deep image understanding is an ongoing research problem. Scene graphs and natural language captions have a common characteristic in that they are generated by considering the objects in the images and the relationships between the objects. This study proposes a deep neural network model named the Context-based Captioning and Scene Graph Generation Network (C2SGNet), which simultaneously generates scene graphs and natural language captions from images. The proposed model generates results through communication of context information between these two tasks. For effective communication of context information, the two tasks are structured into three layers: the object detection, relationship detection, and caption generation layers. Each layer receives related context information from the lower layer. In this study, the proposed model was experimentally assessed using the Visual Genome benchmark data set. The performance improvement effect of the context information was verified through various experiments. Further, the high performance of the proposed model was confirmed through performance comparison with existing models.",Donghyeop Shin|Incheol Kim,Kyonggi University|Kyonggi University,8,Deep Image Understanding Using Multilayered Contexts,https://doi.org/10.1155/2018/5847460,0.7219127,FALSE,en,TRUE,hybrid,Mathematical Problems in Engineering,journal,2018-12-10,article
https://openalex.org/W2904993015,,Ning Xu|An-An Liu|Jing Liu|Weizhi Nie|Yuting Su,Tianjin University|Tianjin University|Tianjin University|Tianjin University|Tianjin University,93,Scene graph captioner: Image captioning based on structural visual representation,https://doi.org/10.1016/j.jvcir.2018.12.027,6.2084492,FALSE,en,FALSE,closed,Journal of Visual Communication and Image Representation,journal,2018-12-14,article
https://openalex.org/W2921465855,"Scene graphs, as found in many visualization systems are a well-established concept for modeling virtual scenes in computer graphics. State-of-the-art approaches typically issue appropriate draw commands while traversing the graph. Equipped with a functional programming mindset we take a different approach and utilize attribute grammars as a central concept for modeling the problem domain declaratively. Instead of issuing draw commands imperatively, we synthesize first class objects describing appropriate draw commands. In order to make this approach practical in the face of dynamic changes to the scene graph, we utilize incremental evaluation, and thereby avoid repeated evaluation of unchanged parts. Our application prototypically demonstrates how complex systems benefit from domain-specific languages, declarative problem solving and the implications thereof. Besides from being concise and expressive, our solution demonstrates a real-world use case of self-adjusting computation which elegantly extends scene graphs with well-defined reactive semantics and efficient, incremental execution.",Harald Steinlechner|Georg Haaser|Stefan Maierhofer|Robert F. Tobler,VRVis GmbH (Austria)|VRVis GmbH (Austria)|VRVis GmbH (Austria)|VRVis GmbH (Austria),2,Attribute Grammars for Incremental Scene Graph Rendering,https://doi.org/10.5220/0007372800770088,0.21377151,FALSE,en,TRUE,gold,,,2019-01-01,article
https://openalex.org/W2930097295,,Moshiko Raboh|Roei Herzig|Gal Chechik|Jonathan Berant|Amir Globerson,,2,Learning Latent Scene-Graph Representations for Referring Relationships.,,0.30723549,FALSE,en,FALSE,closed,,,2019-01-01,article
https://openalex.org/W2989377923,"Scene graphs represent semantic information in images, which can help image captioning system to produce more descriptive outputs versus using only the image as context. Recent captioning approaches rely on ad-hoc approaches to obtain graphs for images. However, those graphs introduce noise and it is unclear the effect of parser errors on captioning accuracy. In this work, we investigate to what extent scene graphs can help image captioning. Our results show that a state-of-the-art scene graph parser can boost performance almost as much as the ground truth graphs, showing that the bottleneck currently resides more on the captioning models than on the performance of the scene graph parser.",Dalin Wang|Daniel Beck|Trevor Cohn,,29,On the Role of Scene Graphs in Image Captioning,https://doi.org/10.18653/v1/d19-6405,1.60328636,FALSE,en,TRUE,gold,,,2019-01-01,article
https://openalex.org/W3119360229,,Lateef Idan Subuh,,0,Placement of digital technology in the production of Scene graph Tarzan as a- symbol –,,0.0,FALSE,en,FALSE,closed,"LARK  JOURNAL FOR  PHILOSOPHY , LINGUISTICS AND SOCIAL SCIENCES",journal,2019-01-01,article
