id,abstract,authorships.author.display_name,authorships.institutions.display_name,cited_by_count,title,doi,fwci,is_retracted,language,is_oa,oa_status,primary_location.source.display_name,primary_location.source.type,publication_date,type
https://openalex.org/W7125951488,"Robotic companions have the potential to revolutionize daily life by helping users with ev-eryday tasks, improving safety, and enhancing quality of life in home environments. However, advancing these robotic companions requires addressing three distinct technical challenges. First, representative household simulation environments lack realistic human agents that move and in- teract naturally with scenes, which limits the development and testing of human-robot interaction algorithms. Second, robots must be able to interpret and respond to user commands given in nat- ural language, a task complicated by the inherent ambiguity in human communication. Finally, to meaningfully improve home safety, robots must be able to detect and respond to emergency situations. This dissertation addresses each of these challenges through novel methods spanning simulation, communication, and emergency response. In simulation, we present PAAK and PACE, novel methods for creating realistic virtual human agents in 3D environments. PAAK places motion-captured human animations into 3D scenes, maintaining human-scene interactions by using “keyframes”—the most important frames for modeling those interactions. PACE builds upon this by modifying motion sequences to adapt to dense, cluttered environments, adjusting the high-DOF pose at each frame to account for unique geometric constraints, and received Best Paper Honorable Mention at IEEE VR 2023. For user communication, we present LGX and LBAP, which enable robots to understand natural language commands and handle ambiguity. LGX leverages Large Language Models (LLMs) for language-guided zero-shot object navigation, achieving a 27% improvement in zero-shot success rate over prior methods on RoboTHOR, with successful real-world validation on a TurtleBot 2 platform. LBAP uses Bayesian inference for uncertainty alignment in LLM planners, mitigat- ing hallucinations and better aligning confidence measures with probability of success, reducing human intervention by over 33% at 70% success rate in real-world experiments on a ClearPath TurtleBot. For household emergencies, we present SafetyDetect and HomeEmergency, enabling robots to detect and respond to dangerous situations. SafetyDetect introduces a dataset of 1000 anoma- lous home scenarios and an LLM-based approach using scene graphs to identify unsafe or unsan- itary conditions, achieving a 96% anomaly detection rate in simulation and 89% on a ClearPath TurtleBot in real-world scenarios. HomeEmergency addresses actively occurring emergencies like falls and fires using audio localization through a novel probabilistic dynamic scene graph, where Bayesian inference enables efficient agent localization, with validation across 30 real- world experiments in apartment environments. While PAAK is primarily a simulation tool, our other methods include real-world validation: LGX, LBAP, SafetyDetect, and HomeEmergency all demonstrate effectiveness on physical robotic platforms. Together, these contributions ad- vance robotic companions across research tools, communication capabilities, and safety features, moving toward more helpful and trustworthy robotic companions.",James Mullen,,0,"ENABLING SAFE ROBOTIC COMPANIONS THROUGH HUMAN-AWARE SIMULATION, NATURAL COMMUNICATION, AND EMERGENCY RESPONSE",https://doi.org/10.13016/lhn0-g6g5,,FALSE,en,TRUE,green,Digital Repository at the University of Maryland (University of Maryland College Park),repository,2025-01-01,other
https://openalex.org/W4412888293,,Bowen Yan|Zhengsong Zhang|Liqiang Jing|Eftekhar Hossain|Xinya Du,,0,FIHA: Automated Fine-grained Hallucinations Evaluations in Large Vision Language Models with Davidson Scene Graphs,https://doi.org/10.18653/v1/2025.findings-acl.622,0.0,FALSE,en,TRUE,gold,,,2025-01-01,article
https://openalex.org/W4411071448,,Jiho Bae|Bong-Jong Choi|Sang–Ho Yeon|Suwon Lee,,1,Fusion Prototypical Network for 3D Scene Graph Prediction,https://doi.org/10.32604/cmes.2025.064789,4.0917585,FALSE,en,TRUE,diamond,Computer Modeling in Engineering & Sciences,journal,2025-01-01,article
https://openalex.org/W7118397357,"Perception systems in autonomous and advanced driver assistance vehicles increasingly rely on large, data driven neural architectures that achieve strong accuracy but remain fundamentally opaque. Their internal reasoning is difficult to interpret, verify, or trace, which poses challenges for the safety certification, debugging, and regulatory transparency. Existing attempts at interpretable perception such as symbolic reasoning, attention visualization, or post hoc saliency rarely provide structured, causally meaningful explanations that planners, auditors, or human operators can reliably trust. This paper introduces a generative perception framework that produces a fully interpretable scene graph representation as the primary output rather than as an optional diagnostic layer. The scene graph encodes objects, semantic attributes, relations, interactions, and driving relevant affordances in a structured form compatible with downstream decision making and formal analysis. The proposed approach employs a generative model that operates in graph latent space to enforce global physical and semantic consistency. Instead of passively extracting relations, the model actively predicts missing, uncertain, or occluded components while maintaining adherence to vehicle dynamics constraints, traffic rules, and common sense priors learned from data. This generative mechanism allows the perception system to expose uncertainty at the node, relation, and affordance levels, enabling explicit traceability of potential failure modes. The resulting graph structure serves as both an interpretable explanation of system’s perception and a robust intermediate representation for planning. Experiments conducted on multi sensor autonomous driving datasets demonstrate that generative scene graphs substantially improve explanation quality and relational correctness, especially under occlusions and degraded sensing. At the same time, detection performance remains competitive with state of the art black box methods. By unifying generative modeling, relational reasoning, and structured explainability, this work positions generative scene graphs as a practical step toward transparent, auditable, and regulator aligned perception pipelines in autonomous vehicles.",Gaurav Pokharkar,Film Independent,0,Generative Scene Graphs for Explainable Perception in Autonomous Vehicles,https://doi.org/10.63282/3050-9262.ijaidsml-v6i4p125,0.0,FALSE,,TRUE,hybrid,International Journal of Artificial Intelligence Data Science and Machine Learning,journal,2025-01-01,article
https://openalex.org/W4409580820,"Deformable Multi-Linear Objects (DMLOs), or Branched Deformable Linear Objects (BDLOs), are flexible objects that possess a linear structure similar to DLOs but also feature branching or bifurcation points where the object’s path diverges into multiple sections. The representation of complex DMLOs, such as wiring harnesses, poses significant challenges in various applications, including robotic systems’ perception and manipulation planning. This paper proposes an approach to address the robust and efficient estimation of a topological representation for DMLOs leveraging a graph-based description of the scene obtained via graph neural networks. Starting from a binary mask of the scene, graph nodes are sampled along the objects’ estimated centerlines. Then, a data-driven pipeline is employed to learn the assignment of graph edges between nodes and to characterize the node’s type based on their local topology and orientation. Finally, by utilizing the learned information, a solver combines the predictions and generates a coherent representation of the objects in the scene. The approach is experimentally evaluated using a test set of complex real-world DMLOs. Within an offline evaluation, the proposed approach achieves a Dice score exceeding 90% in predicting graph edges. Similarly, the identification accuracy of branch and intersection points in the graph topology is above 90%. Additionally, the method demonstrates efficient performance, achieving a runtime of over 20 FPS. In an online assessment employing a dual-arm robotic setup, the approach is successfully applied to disentangle three automotive wiring harnesses, demonstrating the effectiveness of the proposed approach in a real-world scenario.",Alessio Caporali|Kevin Galassi|Riccardo Zanella|Gianluca Palli,University of Bologna|University of Bologna|University of Twente|University of Bologna,0,GNN Topology Representation Learning for Deformable Multi-Linear Objects Dual-Arm Robotic Manipulation,https://doi.org/10.1109/tase.2025.3562231,0.0,FALSE,en,TRUE,hybrid,IEEE Transactions on Automation Science and Engineering,journal,2025-01-01,article
https://openalex.org/W4407948571,,Fan Yu|Beibei Zhang|Tongwei Ren|Jiale Liu|Gangshan Wu|Jinhui Tang,Nanjing University|Nanjing University|Nanjing University|Nanjing University|Nanjing University|Nanjing University of Science and Technology,0,Group Visual Relation Detection,https://doi.org/10.1109/tip.2025.3543114,0.0,FALSE,en,FALSE,closed,IEEE Transactions on Image Processing,journal,2025-01-01,article
https://openalex.org/W7128098921,,Nyffeler Jon|Tombari Federico|Dániel Baráth,,0,Hierarchical 3D Scene Graphs Construction Outdoors,,0.0,FALSE,en,FALSE,closed,SZTAKI Publication Repository (Hungarian Academy of Sciences),repository,2025-01-01,article
https://openalex.org/W4415883255,,Linlin Wang|Tingzhu Wang|Junwei Luo|Yansheng Li,Wuhan University|Wuhan University|Wuhan University|Wuhan University,0,Hierarchical Prototype Learning via Aggregation-Decomposition for Fine-Grained Geospatial Scene Graph Generation,https://doi.org/10.1109/tgrs.2025.3629400,,FALSE,,FALSE,closed,IEEE Transactions on Geoscience and Remote Sensing,journal,2025-01-01,article
https://openalex.org/W7125807346,"In recent years, computer vision has undergone a paradigm shift from static, model-centric analysis to dynamic, interactive systems. These systems empower users to guide and refine model behavior with visual and textual prompts, transforming them from passive observers into active collaborators. This evolution significantly enhances model effectiveness, resolves ambiguity, and broadens the accessibility of AI-driven applications. This thesis presents a cohesive journey through the landscape of interactive prompting, charting a course from simple pixel-level guidance to complex semantic reasoning. The journey begins with interactive visual prompting, where minimal user input is leveraged to solve complex segmentation tasks. The first chapter introduces SimpSON, a novel framework that dramatically simplifies photo cleanup by segmenting multiple distracting objects with just a single click. The subsequent chapter advances this theme with MaGGIe, which tackles the inherent ambiguity of instance matting in multi-person scenes. By using coarse mask prompts, MaGGIe achieves precise alpha mattes, demonstrating how minimal but targeted guidance can ensure robust and accurate outcomes. These works underscore how simple visual interactions can profoundly enhance segmentation accuracy while minimizing user effort. The thesis then transitions to interactive textual prompting, exploring how natural language unlocks greater expressivity in vision systems. The third part introduces CoLLM, a retrieval framework that aligns nuanced textual descriptions with precise visual content without relying on explicitly annotated triplet datasets. Building upon this, the fourth part expands into the omni-modal domain with OmniRet, a unified model that seamlessly integrates image, video, audio, and text. OmniRet learns a joint embedding space to interpret complex, cross-modal user queries, establishing a new foundation model for flexible and efficient information retrieval systems. The final part of this thesis confronts the core challenge of unstructured prompts by introducing structured semantic representations. This section establishes the scene graph as a critical intermediate representation for bridging the gap between language and vision. We demonstrate its power across three domains: enhancing the relational alignment in image-text matching, guiding the compositional generation of content in text-to-image synthesis, and enabling verifiable, grounded action sequences in robotic task planning. These applications reveal how structured semantics are key to unlocking more robust, accurate, and interpretable AI. Collectively, this thesis charts a clear path from simple interactions to sophisticated reasoning, providing a comprehensive exploration of prompting paradigms that are making computer vision systems more responsive, precise, and intuitive. These advancements not only redefine user-model collaboration but also mark significant progress toward more powerful and accessible artificial intelligence.",Chuong Minh Huynh,,0,INTERACTIVE VISION SYSTEMS WITH VISUAL AND TEXTUAL PROMPTS,https://doi.org/10.13016/mkmn-bjzj,,FALSE,en,TRUE,green,Digital Repository at the University of Maryland (University of Maryland College Park),repository,2025-01-01,other
https://openalex.org/W7106019790,"Recent years have seen increasing interest in developing robots that are capable of lifelong and reliable operations around humans in home and factory environments. Despite impressive recent progress towards long-horizon tasks such as laundry fold ing, current efforts are predominantly focused on quasi-static tasks in very structured settings. General-purpose robots that assist humans in daily tasks should be capable of performing a wider range of dynamic and dexterous tasks in unstructured environments, safely interact with humans and their environment, and effectively learn from and adapt to new experiences. One promising approach to building robots capable of assistive lifelong opera tions is to endow them with three core capabilities: a metric, semantic, and temporal (memory) understanding of the world, the ability to perform long-horizon reasoning and planning, and the capacity to execute real-time, closed-loop policies that are dex terous, reactive, and safe in dynamic environments. Such an approach necessitates bridging a fundamental gap in the field. On one hand, traditional approaches based on classical control can provide strong guarantees for safety and optimality for real-time reactive control of dynamic tasks; however, they often rely on low-dimensional, fully observable states and often lack semantic awareness. In contrast, recent advances in vision-language-action models capture rich world semantics and generalize to novel settings, but are typically limited to quasi-static tasks and do not explicitly handle safety or adapt to dynamic changes in real time. The goal of this thesis work is to bridge this gap by exploring methods at the intersection of modern control theory, robot learning, and multimodal foundation models, with the goal of learning generalizable and safety-aware robot policies capable of performing complex, dynamic, and interactive tasks in unstructured environments. Towards this goal, this thesis explores various approaches for leveraging strong structural, algorithmic and semantic priors that can enable both generalization as well as real-time reactive control of dynamic tasks. Our works (1; 2) focus on learn ing to perform dynamic pickup tasks using dynamic-Graph Neural Networks (GNNs) as structural priors and differentiable control algorithms (iLQR) as algorithmic priors for learning compositional skills that operate over multiple dynamic modes as well as generalize to complex environments and novel goals. (1) introduces a framework for learning differentiable optimal skills (LQR) for switching linear dynamical systems from expert demonstrations. The resulting control scheme predicts and accounts for discontinuities due to contact, reacts to unanticipated contact events and generalizes to novel goal conditions and skill compositions. (2) extends this framework to non-linear multibody interactive systems by learning stable locally linear dynamics models using dynamic-GNNs, which enables generalization to novel number of objects and interactions unseen during training. MResT (3) combines the seman tic reasoning capabilities of pre-trained frozen vision-language models (used at low frequency), with the adaptiveness of fine-tuned smaller networks (used at high fre quency), to enable zero-shot generalization to semantic scene variations as well as real time closed-loop control of precise and dynamic tasks. This work focuses on learning generalizable multi-task policies using multi-resolution sensing in table-top settings for short-horizon tasks. GraphEQA(4), considers the long-horizon task of embodied question answering in large unseen indoor environments. GraphEQA, in real-time, constructs a multi-modal memory comprising a real-time 3D metric-semantic scene graph and task-relevant images, for grounding a VLM-based hierarchical planner to perform situated and semantically-informed long-horizon exploration and planning. Finally, VLTSafe (5) combines the semantic safety reasoning capabilities of large pre trained VLMs with safety guarantees of low-level reachability-based RL policies to enable safe control of dynamic tasks in cluttered environments. This approach uses a VLM for identifying relevant task- and safety constraints which inform pretrained parameterized reachability-based RL policies during execution. This thesis takes a step towards the development of generalist embodied agents that integrate the semantic understanding and generalizability of multimodal foundation models with robust, closed-loop control policies that ensure efficiency, dexterity and safety and opens new avenues for future research in scalable, safe, and generalizable robot learning","Saxena, Saumya",Carnegie Mellon University,0,Learning Generalizable Robot Skills for Dynamic and Interactive Tasks,https://doi.org/10.1184/r1/30533204,0.0,FALSE,,TRUE,green,KiltHub Repository,repository,2025-01-01,article
https://openalex.org/W4406365662,,Tao He|Xin Hu|Tongtong Wu|Dongyang Zhang|Xiaogang Li|Yuan-Fang Li|F. Richard Yu,Oldham Council|Oldham Council|Australian Regenerative Medicine Institute|Monash University|University of Electronic Science and Technology of China|Oldham Council|Australian Regenerative Medicine Institute|Monash University|Carleton University,0,Lifelong Scene Graph Generation,https://doi.org/10.2139/ssrn.5097096,,FALSE,en,TRUE,green,SSRN Electronic Journal,repository,2025-01-01,preprint
https://openalex.org/W4415820634,,Zhipeng Wang|Qiao Pan|Yanmin Zhou|Rong Jiang|Jiajun Ma|Bin He|Xin Li,Intelligent Systems Research (United States)|Intelligent Systems Research (United States)|Intelligent Systems Research (United States)|Intelligent Systems Research (United States)|Intelligent Systems Research (United States)|Intelligent Systems Research (United States)|Shanghai Maritime University,1,Long-Sequence Task Planning for Flexible Assembly With Spatio-Temporal Scene Graph,https://doi.org/10.1109/tase.2025.3628487,,FALSE,,FALSE,closed,IEEE Transactions on Automation Science and Engineering,journal,2025-01-01,article
https://openalex.org/W4408131094,,Xiaoguang Chang|Damien Teney|Teng Wang|Lele Xu|Changyin Sun,,0,Masked Vision-and-Language Pre-Training for Scene Graph Generation,https://doi.org/10.2139/ssrn.5165690,,FALSE,en,TRUE,green,SSRN Electronic Journal,repository,2025-01-01,preprint
https://openalex.org/W4412856867,,Xuejiao Wang|Ziheng Huang|Weiliang Meng|Changbo Wang|Gaoqi He,,0,Medp: Multimodal-Enhanced Dynamic Prototype Learning for Few-Shot Dynamic Scene Graph Generation,https://doi.org/10.2139/ssrn.5376753,,FALSE,en,TRUE,green,SSRN Electronic Journal,repository,2025-01-01,preprint
https://openalex.org/W4413238099,,Xiaotian Lv|Yue Zhao|Hanlong Yin|Yifei Chen|Jianxing Liu,Harbin Institute of Technology|Harbin Institute of Technology|Harbin Institute of Technology|Harbin Institute of Technology|Harbin Institute of Technology,0,Msg-Clip: Enhancing Clip's Ability to Learn Fine-Grained Structural Associations Through Multi-Modal Scene Graph Alignment,https://doi.org/10.2139/ssrn.5385250,,FALSE,en,TRUE,green,SSRN Electronic Journal,repository,2025-01-01,preprint
https://openalex.org/W4408100020,,Xinyu Lyu|Lianli Gao|Junlin Xie|Pengpeng Zeng|Yulu Tian|Jie Shao|Hengtao Shen,Southwestern University of Finance and Economics||University of Electronic Science and Technology of China|||University of Electronic Science and Technology of China|University of Electronic Science and Technology of China,1,Multi-Concept Learning for Scene Graph Generation,https://doi.org/10.1109/tip.2025.3540296,19.30239969,FALSE,en,FALSE,closed,IEEE Transactions on Image Processing,journal,2025-01-01,article
https://openalex.org/W4408441582,"Neurosymbolic Scene Graph Generation (SGG) is a promising approach that jointly leverages the perception capabilities of deep neural networks and the reasoning capabilities of symbolic techniques for scene understanding and visual reasoning. SGG systematically captures semantic components, including objects and their relationships, in images, enabling structured representations of visual data. However, existing SGG methods exhibit constrained accuracy and limited expressiveness, particularly in long-tail relationship prediction. To address these limitations, we present MuRelSGG, a novel neurosymbolic SGG framework that integrates a Transformer-based multimodal relationship prediction pipeline with common sense knowledge enrichment. This synergistic combination encapsulates global context, long-range dependencies, and complex object interactions to enhance relationship prediction in SGG. The proposed neurosymbolic architecture begins with object detection via Faster R-CNN, followed by a cascade of Multi-Head Attention Transformers (M-HAT) and Vision Transformers (ViT) for relationship prediction. Subsequently, CSKG enrichment refines and augments visual relationships, improving both accuracy and expressiveness. We conduct extensive evaluations on both the Visual Genome (VG) and GQA datasets to assess performance and generalizability. MuRelSGG achieves substantial gains in recall rates (VG: R@ 100=43.2 , mR@ 100=14.9 ; GQA: R@ 100=42.1 ), outperforming state-of-the-art SGG techniques. Ablation studies confirm the critical contributions of M-HAT, ViT, linguistic features, CSKG enrichment and embedding similarity thresholds, demonstrating the effectiveness of structured knowledge integration for long-tail relationship prediction. These findings underscore the potential of combining deep learning architectures with structured knowledge bases to advance visual scene representation and reasoning.",Muhammad Junaid Khan|Adil Masood Siddiqui|Hamid Saeed Khan|Faisal Akram|Muhammad Jaleed Khan,National University of Sciences and Technology|Ollscoil na Gaillimhe – University of Galway|National University of Sciences and Technology|Medical Diagnostic Laboratories (United States)|National University of Sciences and Technology|National University of Sciences and Technology|Ollscoil na Gaillimhe – University of Galway,2,MuRelSGG: Multimodal Relationship Prediction for Neurosymbolic Scene Graph Generation,https://doi.org/10.1109/access.2025.3551267,9.63949029,FALSE,en,TRUE,gold,IEEE Access,journal,2025-01-01,article
https://openalex.org/W7128203524,,Mohammad Rafeeq|Narendra Bijarniya|Chandramani Chaudhary,"National Institute of Technology Calicut|Birla Institute of Technology and Science, Pilani|National Institute of Technology Calicut",0,Next-Event Prediction in Cybercrime Complaint Narratives Using Temporal Event Scene Graphs,https://doi.org/10.5220/0013647000003967,0.0,FALSE,,FALSE,closed,,,2025-01-01,article
https://openalex.org/W4417002434,,Liguang Zhou|Junjie Hu|Yuhongze Zhou|Tin Lun Lam|Yangsheng Xu,"Chinese University of Hong Kong, Shenzhen|Chinese University of Hong Kong, Shenzhen|McGill University|Chinese University of Hong Kong, Shenzhen|Chinese University of Hong Kong, Shenzhen",0,Peer Learning Approach to Unbiased Scene Graph Generation for Traffic Scene Understanding,https://doi.org/10.1109/tits.2025.3635279,,FALSE,,FALSE,closed,IEEE Transactions on Intelligent Transportation Systems,journal,2025-01-01,article
https://openalex.org/W7126756877,,Nathalie S. Borgognon|Laurent Morcozzet|Gaëlle Molinari,,0,Phygital Continuity of Hybrid Collaborative Fabrication Activities in FacLabs,,,FALSE,,FALSE,closed,Open MIND,repository,2025-01-01,other
https://openalex.org/W7115094698,,"Leong, Jing Yun",,0,Revolutionising surgical training through a chain-of-thought approach to visual-question answering,,,FALSE,en,FALSE,closed,DR-NTU (Nanyang Technological University),repository,2025-01-01,other
