no,arxiv_url,title,authors,abstract_kor
780,http://arxiv.org/abs/2503.17224 ,Neuro-Symbolic Scene Graph Conditioning for Synthetic Image Dataset Generation,"Giacomo Savazzi, Eugenio Lomurno, Cristian Sbrolli, Agnese Chiatti, Matteo Matteucci","기계 학습 모델의 규모와 복잡성이 증가함에 따라 충분한 교육 데이터를 얻는 것이 취득 비용, 개인 정보 보호 제약 및 전문 도메인의 데이터 부족으로 인해 심각한 병목 현상이 되었습니다. 합성 데이터 생성이 유망한 대안으로 떠올랐지만, 특히 작업 복잡성이 증가함에 따라 실제 데이터로 훈련된 모델에 비해 눈에 띄는 성능 격차가 남아 있습니다. 동시에, 신경망의 학습 강점과 상징적 추론의 구조화된 표현을 결합한 신경 상징적 방법은 다양한 인지 작업 전반에 걸쳐 상당한 잠재력을 보여주었습니다. 이 문서에서는 특히 장면 그래프 생성 모델의 성능 향상에 중점을 두고 합성 이미지 데이터 세트 생성을 위한 신경 기호 조건화의 유용성을 살펴봅니다. 이 연구에서는 장면 그래프 형태의 구조화된 기호 표현이 관계 제약 조건의 명시적인 인코딩을 통해 합성 데이터 품질을 향상시킬 수 있는지 여부를 조사합니다. 결과는 Neuro-Symbolic 컨디셔닝이 데이터 세트 확대에 사용될 때 표준 Recall 메트릭에서 최대 +2.59%, No Graph Constraint Recall 메트릭에서 최대 +2.83%의 상당한 개선을 가져온다는 것을 보여줍니다. 이러한 연구 결과는 Neuro-Symbolic 접근 방식과 생성 접근 방식을 병합하면 실제 데이터와 결합할 때 모델 성능을 향상시키는 보완적인 구조 정보가 포함된 합성 데이터를 생성하여 복잡한 시각적 추론 작업에서도 데이터 부족 한계를 극복할 수 있는 새로운 접근 방식을 제공한다는 사실을 입증했습니다."
779,http://arxiv.org/abs/2503.16867 ,ETVA: Evaluation of Text-to-Video Alignment via Fine-grained Question Generation and Answering,"Kaisi Guan, Zhengfeng Lai, Yuchong Sun, Peng Zhang, Wei Liu, Kieran Liu, Meng Cao, Ruihua Song","텍스트 프롬프트와 생성된 비디오 간의 의미 체계 정렬을 정확하게 평가하는 것은 T2V(텍스트-비디오) 생성에서 여전히 어려운 과제입니다. CLIPScore와 같은 기존 텍스트-비디오 정렬 측정항목은 세밀한 정렬 세부 정보 없이 대략적인 점수만 생성하므로 사람의 선호도에 맞춰 정렬하지 못합니다. 이러한 한계를 해결하기 위해 우리는 세밀한 질문 생성 및 답변을 통한 텍스트-비디오 정렬의 새로운 평가 방법인 ETVA를 제안합니다. 첫째, 다중 에이전트 시스템은 프롬프트를 의미론적 장면 그래프로 구문 분석하여 원자적 질문을 생성합니다. 그런 다음 질문 답변을 위한 지식 증강 다단계 추론 프레임워크를 설계합니다. 여기서 보조 LLM은 먼저 관련 상식 지식(예: 물리 법칙)을 검색한 다음 비디오 LLM이 다단계 추론 메커니즘을 통해 생성된 질문에 답변합니다. 광범위한 실험에 따르면 ETVA는 Spearman의 상관 계수인 58.47을 달성했으며, 이는 31.0에 불과한 기존 지표보다 인간 판단과 훨씬 더 높은 상관 관계를 보여줍니다. 또한 우리는 10개 범주에 걸쳐 2,000개의 다양한 프롬프트와 12,000개의 원자 질문을 특징으로 하는 텍스트-비디오 정렬 평가를 위해 특별히 설계된 포괄적인 벤치마크를 구축합니다. 기존 15개 텍스트-비디오 모델에 대한 체계적인 평가를 통해 주요 기능과 한계를 식별하여 차세대 T2V 세대의 기반을 마련합니다."
778,http://arxiv.org/abs/2503.17406 ,IRef-VLA: A Benchmark for Interactive Referential Grounding with Imperfect Language in 3D Scenes,"Haochen Zhang, Nader Zantout, Pujith Kachana, Ji Zhang, Wenshan Wang","최근 대규모 언어 모델, 비전 언어 모델 및 기타 일반 기반 모델이 등장하면서 자연어 입력이 주어지는 다양한 환경에서 작동할 수 있는 다중 모드, 다중 작업 로봇 공학의 잠재력이 커지고 있습니다. 이러한 응용 프로그램 중 하나는 자연어 지침을 사용하는 실내 탐색입니다. 그러나 최근의 진전에도 불구하고 이 문제는 3차원 공간 추론과 의미론적 이해가 필요하기 때문에 여전히 어려운 문제입니다. 또한 사용된 언어가 불완전하거나 장면과 잘못 정렬되어 작업이 더욱 복잡해질 수 있습니다. 이 문제를 해결하기 위해 우리는 불완전한 참조가 있는 3D 장면의 대화형 참조 비전 및 언어 기반 동작을 위한 벤치마크 데이터 세트 IRef-VLA를 선별합니다. IRef-VLA는 참조 접지 작업을 위한 최대 규모의 실제 데이터 세트로, 기존 데이터 세트에서 11.5K개 이상의 스캔된 3D 공간, 경험적으로 생성된 의미 관계 760만 개, 참조 문 470만 개로 구성됩니다. 우리의 데이터 세트에는 의미 개체 및 방 주석, 장면 그래프, 탐색 가능한 여유 공간 주석도 포함되어 있으며 언어에 불완전하거나 모호한 부분이 있는 설명으로 보강됩니다. 우리는 성능 기준을 얻기 위해 최첨단 모델을 평가하여 데이터 세트의 일반화 가능성을 검증하고 장면 그래프 지식을 사용하여 성능 한계와 대안 생성을 입증하기 위한 그래프 검색 기준을 개발합니다. 이 벤치마크를 통해 우리는 강력한 대화형 탐색 시스템 개발에 도움이 되는 3D 장면 이해를 위한 리소스를 제공하는 것을 목표로 합니다. 데이터세트와 모든 소스 코드는 https://github.com/HaochenZ11/IRef-VLA에 공개되어 있습니다."
777,http://arxiv.org/abs/2503.15846 ,What can Off-the-Shelves Large Multi-Modal Models do for Dynamic Scene Graph Generation?,"Xuanming Cui, Jaiminkumar Ashokbhai Bhoi, Chionh Wei Peng, Adriel Kuek, Ser Nam Lim","비디오용 DSGG(Dynamic Scene Graph Generation)는 컴퓨터 비전에서 어려운 작업입니다. 기존 접근 방식은 정교한 아키텍처 설계에 초점을 맞추고 평가 중에 리콜만 사용하는 경우가 많지만, 예측된 장면 그래프를 자세히 살펴보고 기존 DSGG 방법에서 심각한 정밀도-리콜 절충, 삼중항 중요성에 대한 인식 부족, 부적절한 평가 프로토콜이라는 세 가지 중요한 문제를 발견했습니다. 반면, 최근 LMM(Large Multimodal Model)의 발전은 비디오 이해에 있어 뛰어난 기능을 보여 주었지만 DSGG와 같은 세분화된 프레임별 이해 작업에서는 테스트되지 않았습니다. 이 작업에서는 DSGG를 수행하기 위한 비디오 LMM에 대한 최초의 체계적인 분석을 수행합니다. 정교한 아키텍처 설계에 의존하지 않고 간단한 디코더 전용 구조를 가진 LMM이 앞서 언급한 문제를 효과적으로 극복하는 동시에 미세 조정(5-10% 훈련 데이터)이 거의 필요하지 않은 최첨단 장면 그래프 생성기로 전환될 수 있음을 보여줍니다."
776,http://arxiv.org/abs/2503.15761 ,GraPLUS: Graph-based Placement Using Semantics for Image Composition,"Mir Mohammad Khaleghi, Mehran Safayani, Abdolreza Mirzaei","우리는 장면 그래프와 대규모 언어 모델을 활용하는 이미지에서 그럴듯한 객체 배치를 위한 새로운 프레임워크인 GraPLUS(Graph-based Placement Using Semantics)를 제시합니다. 우리의 접근 방식은 그래프 구조의 장면 표현과 의미론적 이해를 고유하게 결합하여 상황에 맞는 개체 위치를 결정합니다. 프레임워크는 GPT-2를 사용하여 범주형 노드 및 에지 레이블을 정의 특성과 일반적인 공간 컨텍스트를 모두 캡처하는 풍부한 의미 체계 임베딩으로 변환하여 객체 관계 및 배치 패턴에 대한 미묘한 이해를 가능하게 합니다. GraPLUS는 OPA 데이터 세트에서 92.1%의 배치 정확도와 28.83의 FID 점수를 달성하여 경쟁력 있는 시각적 품질을 유지하면서 최첨단 방법보다 8.1% 더 뛰어난 성능을 발휘합니다. 19명의 참가자가 평가한 964개의 샘플을 포함하는 인간 평가 연구에서 52.1%의 사례에서 우리의 방법이 선호되었으며 이는 이전 접근 방식보다 훨씬 뛰어났습니다. 프레임워크의 주요 혁신에는 (i) 다른 도메인의 지식을 전달하는 사전 훈련된 장면 그래프 모델 활용, (ii) 구조화된 관계를 통해 장면 의미론을 처리하는 에지 인식 그래프 신경망, (iii) 향상된 장면 기능과 범주형 임베딩을 정렬하는 교차 모달 주의 메커니즘, (iv) 의미론적 일관성 제약 조건을 통합한 다목적 훈련 전략이 포함됩니다."
775,http://arxiv.org/abs/2503.15202 ,"A Unified Framework for Real-Time Failure Handling in Robotics Using Vision-Language Models, Reactive Planner and Behavior Trees","Faseeh Ahmad, Hashim Ismail, Jonathan Styrud, Maj Stenmark, Volker Krueger","로봇 시스템은 예상치 못한 장애물, 센서 오류 또는 환경 변화로 인해 실행 실패에 직면하는 경우가 많습니다. 기존의 장애 복구 방법은 미리 정의된 전략이나 사람의 개입에 의존하므로 적응성이 떨어집니다. 이 백서에서는 VLM(Vision-Language Model), 반응 플래너 및 BT(Behavior Tree)를 결합하여 실시간 오류 처리를 가능하게 하는 통합 오류 복구 프레임워크를 제시합니다. 우리의 접근 방식에는 실행 전에 잠재적인 실패를 확인하는 실행 전 검증과 기존 BT 조건을 확인하고 누락된 전제 조건을 추가하며 필요한 경우 새로운 기술을 생성하여 실행 중에 실패를 감지하고 수정하는 대응적 실패 처리가 포함됩니다. 프레임워크는 구조화된 환경 인식을 위해 장면 그래프를 사용하고 지속적인 모니터링을 위해 실행 기록을 사용하여 상황 인식 및 적응형 오류 처리를 지원합니다. 우리는 AI2-THOR 시뮬레이터뿐만 아니라 페그 삽입, 객체 정렬, 서랍 배치와 같은 작업에 대해 ABB YuMi 로봇을 사용한 실제 실험을 통해 프레임워크를 평가합니다. 사전 실행 방법과 반응 방법을 별도로 사용하는 것에 비해 우리의 접근 방식은 더 높은 작업 성공률과 더 큰 적응성을 달성합니다. 절제 연구는 로봇 공학의 효과적인 오류 복구를 위해 VLM 기반 추론, 구조화된 장면 표현 및 실행 기록 추적의 중요성을 강조합니다."
774,http://arxiv.org/abs/2503.15091 ,Intelligent Spatial Perception by Building Hierarchical 3D Scene Graphs for Indoor Scenarios with the Help of LLMs,"Yao Cheng, Zhe Han, Fengyang Jiang, Huaizhen Wang, Fengyu Zhou, Qingshan Yin, Lei Wei","이 문서는 실내 시나리오를 위한 계층적 3D 장면 그래프(3DSG)를 구성하기 위해 LLM(대형 언어 모델)의 기능을 활용하는 새로운 시스템을 도입함으로써 공간 환경에 대한 보다 전체적인 이해를 위한 고급 지능형 로봇 내비게이션의 높은 수요를 다루고 있습니다. 제안된 프레임워크는 풍부한 메트릭 의미 정보를 갖춘 기본 레이어, 시각적 설명자뿐만 아니라 객체 노드의 정확한 포인트 클라우드 표현을 특징으로 하는 객체 레이어, 방, 바닥 및 건물 노드의 상위 레이어로 구성된 3DSG를 구성합니다. LLM의 혁신적인 적용 덕분에 객체 노드뿐만 아니라 룸 노드와 같은 상위 레이어의 노드에도 지능적이고 정확한 방식으로 주석이 추가됩니다. 룸 노드 주석의 정확성과 신뢰성을 향상시키기 위해 LLM을 사용한 룸 분류를 위한 폴링 메커니즘이 제안되었습니다. 철저한 수치 실험은 의미론적 설명을 기하학적 데이터와 통합하여 상황 인식 탐색 및 작업 계획을 위한 도구인 환경의 정확하고 포괄적인 표현을 생성하는 시스템의 능력을 보여줍니다."
773,http://arxiv.org/abs/2503.15019 ,Learning 4D Panoptic Scene Graph Generation from Rich 2D Visual Scene,"Shengqiong Wu, Hao Fei, Jingkang Yang, Xiangtai Li, Juncheng Li, Hanwang Zhang, Tat-seng Chua","최근에 등장한 4D Panoptic Scene Graph(4D-PSG)는 동적 4D 시각적 실제 세계를 포괄적으로 모델링하기 위한 고급 표현을 제공합니다. 불행하게도 현재의 선구적인 4D-PSG 연구는 주로 심각한 데이터 부족 문제와 그에 따른 어휘 부족 문제로 어려움을 겪을 수 있습니다. 또한 벤치마크 생성 방법의 파이프라인 특성으로 인해 성능이 최적화되지 않을 수 있습니다. 이러한 문제를 해결하기 위해 이 문서에서는 풍부한 2D 시각적 장면 주석을 활용하여 4D 장면 학습을 향상시키는 4D-PSG 생성을 위한 새로운 프레임워크를 조사합니다. 먼저, 4D-PSG의 엔드투엔드 생성을 위해 3D 마스크 디코더와 통합된 4D-LLM(4D Large Language Model)을 소개합니다. 연결된 SG 추론 메커니즘은 LLM의 개방형 어휘 기능을 활용하여 정확하고 포괄적인 개체 및 관계 레이블을 반복적으로 추론하도록 추가로 설계되었습니다. 가장 중요한 것은 공간적 시간적 장면 초월 전략이 풍부한 2D SG 주석에서 차원 불변 기능을 4D 장면으로 효과적으로 전송하여 4D-PSG의 데이터 부족을 효과적으로 보상하는 2D에서 4D 시각적 장면 전송 학습 프레임워크를 제안한다는 것입니다. 벤치마크 데이터에 대한 광범위한 실험을 통해 우리는 기준 모델보다 훨씬 뛰어난 성능을 보여 우리 방법의 효율성을 강조했습니다."
772,http://arxiv.org/abs/2503.15005 ,Universal Scene Graph Generation,"Shengqiong Wu, Hao Fei, Tat-Seng Chua","장면 그래프(SG) 표현은 장면 의미론을 깔끔하고 효율적으로 설명할 수 있으며, 이는 SG 생성에 대한 지속적인 집중 연구를 주도해 왔습니다. 현실 세계에서는 이미지, 텍스트, 비디오, 3D 데이터 등 다양한 유형이 서로 다른 특성을 표현하는 여러 양식이 공존하는 경우가 많습니다. 불행하게도 현재 SG 연구는 주로 단일 양식 장면 모델링에 국한되어 전체적인 장면 의미론을 묘사하는 데 있어 다양한 양식 SG 표현의 보완적인 강점을 완전히 활용하지 못합니다. 이를 위해 우리는 양식 불변 장면과 양식 특정 장면을 포괄하는 양식 입력의 주어진 조합으로부터 포괄적인 의미론적 장면을 완전히 특성화할 수 있는 새로운 표현인 Universal SG(USG)를 소개합니다. 또한 우리는 크로스 모달 개체 정렬 및 도메인 외부 문제의 두 가지 주요 병목 현상을 효과적으로 해결하는 틈새 타겟팅 USG 파서인 USG-Par를 맞춤화했습니다. 우리는 엔드-투-엔드 USG 생성을 위한 모듈식 아키텍처로 USG-Par을 설계합니다. 여기서 우리는 교차 모달 객체 정렬을 위한 모달리티 격차를 완화하기 위한 객체 연관자를 고안합니다. 또한 다중 모달 객체와 관계를 텍스트 SG와 정렬하여 도메인 불균형을 완화하기 위한 텍스트 중심 장면 대조 학습 메커니즘을 제안합니다. 광범위한 실험을 통해 우리는 USG가 독립형 SG보다 장면 의미론을 표현하는 데 더 강력한 기능을 제공하고 USG-Par가 더 높은 효율성과 성능을 달성한다는 것을 입증했습니다."
771,http://arxiv.org/abs/2503.14607 ,Can Large Vision Language Models Read Maps Like a Human?,"Shuo Xing, Zezhou Sun, Shuangyu Xie, Kaiyuan Chen, Yanjia Huang, Yuping Wang, Jiachen Li, Dezhen Song, Zhengzhong Tu",본 문서에서는 복잡한 경로 찾기 시나리오에서 선별된 사람이 읽을 수 있는 픽셀 기반 지도 기반 실외 탐색을 위해 특별히 설계된 최초의 데이터세트인 MapBench를 소개합니다. MapBench는 100개의 다양한 지도에서 문제를 찾아내는 1600픽셀 이상의 공간 지도 경로로 구성됩니다. MapBench에서 LVLM은 지도 이미지와 시작 및 끝 랜드마크가 포함된 쿼리를 바탕으로 언어 기반 탐색 지침을 생성합니다. 각 맵에 대해 MapBench는 MSSG(Map Space Scene Graph)를 인덱싱 데이터 구조로 제공하여 자연어 간 변환과 LVLM 생성 결과 평가를 수행합니다. 우리는 MapBench가 제로 샷 프롬프트와 맵 탐색을 순차적 인지 프로세스로 분해하는 CoT(사상 사슬) 증강 추론 프레임워크 모두에서 최첨단 LVLM에 크게 도전하고 있음을 보여줍니다. 오픈 소스 및 폐쇄 소스 LVLM에 대한 우리의 평가는 MapBench가 제기하는 실질적인 어려움을 강조하며 공간 추론 및 구조화된 의사 결정 기능에 중요한 한계가 있음을 드러냅니다. 우리는 https://github.com/taco-group/MapBench에서 모든 코드와 데이터 세트를 공개합니다.
770,http://arxiv.org/abs/2503.13957 ,DIFFVSGG: Diffusion-Driven Online Video Scene Graph Generation,"Mu Chen, Liulei Li, Wenguan Wang, Yi Yang","VSGG(비디오 장면 그래프 생성)를 위한 최고의 솔루션은 일반적으로 오프라인 파이프라인을 채택합니다. 유망한 성능을 보여주었음에도 불구하고 실시간 비디오 스트림을 처리할 수 없고 대용량 GPU 메모리를 소비하지 못합니다. 더욱이 이러한 접근 방식은 시간적 추론이 부족하여 시간적 맥락에 대해 프레임 수준 예측을 집계하는 것뿐입니다. 이에 대한 응답으로 이 작업을 반복적인 장면 그래프 업데이트 문제로 구성하는 온라인 VSGG 솔루션인 DIFFVSGG를 소개합니다. 잠재 기능 임베딩의 노이즈 제거를 통해 이미지를 생성하는 LDM(잠재 확산 모델)에서 영감을 얻어 하나의 공유 기능 임베딩을 사용하여 객체 분류 디코딩, 경계 상자 회귀 및 그래프 생성 세 가지 작업을 통합합니다. 그런 다음 객체 쌍의 통합 기능을 포함하는 임베딩이 주어지면 LDM 내에서 단계별 노이즈 제거를 수행하여 객체 간의 관계를 명확하게 나타내는 깨끗한 임베딩을 제공합니다. 그런 다음 이 임베딩은 객체 분류, 장면 그래프 생성 등을 위한 작업별 헤드에 대한 입력 역할을 합니다. DIFFVSGG는 후속 프레임에 대한 예측이 과거 프레임의 결과를 LDM의 조건부 입력으로 활용하여 현재 프레임에 대한 역확산 프로세스를 안내하는 지속적인 시간적 추론을 더욱 용이하게 합니다. Action Genome의 세 가지 설정에 대한 광범위한 실험은 DIFFVSGG의 우수성을 입증합니다."
769,http://arxiv.org/abs/2503.13947 ,Conformal Prediction and MLLM aided Uncertainty Quantification in Scene Graph Generation,"Sayak Nag, Udita Ghosh, Calvin-Khang Ta, Sarosij Bose, Jiachen Li, Amit K Roy Chowdhury",SGG(장면 그래프 생성)는 객체와 객체의 쌍별 관계를 식별하여 시각적 장면을 표현하고 이미지 콘텐츠에 대한 구조화된 이해를 제공하는 것을 목표로 합니다. 그러나 긴 꼬리 클래스 분포 및 예측 변동성과 같은 본질적인 문제로 인해 SGG의 실제 실행 가능성을 위해서는 불확실성 정량화가 필요합니다. 본 논문에서는 생성된 장면 그래프에 대해 잘 보정된 예측 세트를 구성하여 예측 불확실성을 정량화하기 위해 기존 SGG 방법에 적응하는 새로운 CP(등각 예측) 기반 프레임워크를 소개합니다. 이러한 장면 그래프 예측 세트는 통계적으로 엄격한 적용 범위 보장을 달성하도록 설계되었습니다. 또한 이러한 예측 세트에 가장 실질적으로 해석 가능한 장면 그래프가 포함되도록 하기 위해 이러한 예측 세트 내에서 시각적으로나 의미적으로 가장 그럴듯한 장면 그래프를 선택하기 위한 효과적인 MLLM 기반 후처리 전략을 설계합니다. 우리는 제안된 접근 방식이 이미지에서 다양한 장면 그래프를 생성하고 SGG 방법의 신뢰성을 평가하며 전반적인 SGG 성능을 향상시킬 수 있음을 보여줍니다.
768,http://arxiv.org/abs/2503.12974 ,Exploring 3D Reasoning-Driven Planning: From Implicit Human Intentions to Route-Aware Activity Planning,"Xueying Jiang, Wenhao Li, Xiaoqin Zhang, Ling Shao, Shijian Lu","3D 작업 계획은 최근 다중 모드 학습의 발전으로 인해 인간-로봇 상호 작용 및 AI 구현 분야에서 점점 더 많은 관심을 받고 있습니다. 그러나 대부분의 기존 연구는 두 가지 공통적인 과제에 직면해 있습니다. 1) 암시적인 사용자 의도에 대한 추론이 거의 없이 명시적인 지침에 크게 의존합니다. 2) 로봇 이동에 대한 단계 간 경로 계획을 소홀히 함. 우리는 암시적 지침에서 의도한 활동을 추론하고 이를 장면 분할의 세밀한 3D 개체 모양 및 위치에 따라 계획을 수립하고 단계 간 경로를 사용하여 단계로 분해하는 새로운 3D 작업인 3D 추론 중심 계획을 제안하여 위의 과제를 해결합니다. 우리는 두 가지 관점에서 새로운 3D 작업을 다루고 있습니다. 먼저, 다단계 작업 계획, 단계 간 경로 계획 및 세분화된 분할을 위한 풍부한 암시적 지침과 자세한 주석을 통해 다양한 3D 장면을 포괄하는 대규모 벤치마크인 ReasonPlan3D를 구축합니다. 둘째, 여러 단계에 걸쳐 상황적 일관성을 갖춘 점진적인 계획 생성을 도입하는 새로운 프레임워크와 중요한 개체 및 해당 공간 관계를 캡처하기 위해 동적으로 업데이트되는 장면 그래프를 설계합니다. 광범위한 실험은 암시적인 인간 지시로부터 활동을 추론하고, 정확한 단계별 작업 계획을 생성하고, 다단계 이동을 위한 경로 계획을 원활하게 통합하는 데 있어 벤치마크 및 프레임워크의 효율성을 보여줍니다. 데이터 세트와 코드가 공개됩니다."
767,http://arxiv.org/abs/2503.12552 ,MTGS: Multi-Traversal Gaussian Splatting,"Tianyu Li, Yihang Qiu, Zhenhua Wu, Carl Lindström, Peng Su, Matthias Nießner, Hongyang Li","일상 통근이나 자율 주행 차량을 통해 일반적으로 수집되는 다중 횡단 데이터는 도로 블록 내에서 장면 재구성을 위한 다양한 관점을 제공합니다. 이 데이터는 자율 차량 시뮬레이터와 같은 응용 분야에 중요한 고품질의 새로운 뷰 합성에 대한 상당한 잠재력을 제공합니다. 그러나 다중 순회 데이터의 본질적인 문제로 인해 외관의 변화와 동적 개체의 존재를 포함하여 차선의 재구성 품질이 발생하는 경우가 많습니다. 이러한 문제를 해결하기 위해 우리는 동적 요소와 외관 변화를 별도로 처리하면서 공유된 정적 형상을 모델링하여 임의로 수집된 다중 횡단 데이터로부터 고품질 주행 장면을 재구성하는 새로운 접근 방식인 MTGS(Multi-Traversal Gaussian Splatting)를 제안합니다. 우리의 방법은 학습 가능한 구면 고조파 계수 잔차가 있는 색상 보정 노드로 보완된 공유 정적 노드와 순회별 동적 노드가 있는 다중 순회 동적 장면 그래프를 사용합니다. 이 접근 방식은 충실도가 높은 새로운 뷰 합성을 가능하게 하며 모든 관점을 탐색할 수 있는 유연성을 제공합니다. 다중 주행 데이터를 활용하여 대규모 주행 데이터 세트인 nuPlan에 대한 광범위한 실험을 수행합니다. 우리의 결과는 MTGS가 단일 횡단 기준선에 비해 LPIPS를 23.5%, 형상 정확도를 46.3% 향상시키는 것으로 나타났습니다. 코드와 데이터는 대중에게 공개됩니다."
766,http://arxiv.org/abs/2503.14524 ,Salient Temporal Encoding for Dynamic Scene Graph Generation,Zhihao Zhu,"구조화된 시공간 장면 그래프를 사용하여 동적 장면을 표현하는 것은 새롭고 특히 어려운 작업입니다. 이 작업을 수행하려면 공간적 관계 외에도 개체 간의 시간적 상호 작용을 배우는 것이 중요합니다. 현재 벤치마크 데이터 세트에는 명시적으로 주석이 달린 시간 관계가 없기 때문에 대부분의 기존 공간-시간 장면 그래프 생성 방법은 프레임 전체의 모든 개체 간에 조밀하고 추상적인 시간 연결을 구축합니다. 그러나 모든 시간적 연결이 의미 있는 시간적 역학을 인코딩하는 것은 아닙니다. 우리는 시간적 관련 개체 쌍 사이에서만 시간적 연결을 선택적으로 구축하고 장면 그래프에서 시간적 관계를 명시적인 가장자리로 나타내는 새로운 시공간적 장면 그래프 생성 방법을 제안합니다. 결과적으로 희박하고 명시적인 시간적 표현을 통해 장면 그래프 감지에서 강력한 장면 그래프 생성 기준을 최대 $4.4\%$까지 향상시킬 수 있습니다. 또한 우리의 접근 방식을 활용하여 다운스트림 비전 작업을 개선할 수 있음을 보여줍니다. 특히, 행동 인식에 대한 우리의 접근 방식을 적용하면 최신 기술에 비해 mAP에서 0.6\% 이득을 나타냅니다."
