no,arxiv_url,title,authors,abstract_kor
535,http://arxiv.org/abs/2402.03840 ,Belief Scene Graphs: Expanding Partial Scenes with Objects through Computation of Expectation,"Mario A. V. Saucedo, Akash Patel, Akshit Saradagi, Christoforos Kanellakis, George Nikolakopoulos","본 논문에서는 부분 3D 장면 그래프의 유틸리티 기반 확장으로 부분 정보를 사용하여 효율적이고 높은 수준의 작업 계획을 가능하게 하는 새로운 개념의 Belief 장면 그래프를 제안합니다. 우리는 주어진 3D 장면 그래프에 대한 믿음(기대라고도 함) 계산을 위한 그래프 기반 학습 방법을 제안하며, 이는 로봇 임무와 관련된 새 노드(블라인드 노드라고도 함)를 전략적으로 추가하는 데 사용됩니다. 우리는 사용 가능한 훈련 데이터로부터 히스토그램을 학습함으로써 실제 믿음/기대를 합리적으로 근사화하기 위한 상관 정보(CECI) 기반 기대 계산 방법을 제안합니다. 3D 장면 그래프 저장소에서 CECI를 학습하기 위해 새로운 GCN(Graph Convolutional Neural Network) 모델이 개발되었습니다. 새로운 CECI 모델 훈련을 위한 3D 장면 그래프 데이터베이스가 없기 때문에 의미상 주석이 달린 실제 3D 공간을 기반으로 3D 장면 그래프 데이터 세트를 생성하는 새로운 방법론을 제시합니다. 생성된 데이터세트는 제안된 CECI 모델을 훈련하고 제안된 방법의 광범위한 검증을 위해 활용됩니다. 우리는 기대치를 추상적 표현에 통합하기 위한 핵심 구성 요소로 \textit{Belief Scene Graphs}(BSG)라는 새로운 개념을 확립했습니다. 이 새로운 개념은 고전적인 3D 장면 그래프 개념의 진화이며 다양한 로봇 임무의 작업 계획 및 최적화를 위한 높은 수준의 추론을 가능하게 하는 것을 목표로 합니다. 전체 프레임워크의 효율성은 객체 검색 시나리오에서 평가되었으며, 보이지 않는 객체에 대한 인간의 상식을 모방하기 위한 실제 실험에서도 테스트되었습니다. 실험 시연을 보여주는 기사의 비디오를 보려면 다음 링크를 참조하십시오: https://youtu.be/hsGlSCa12iY"
534,http://arxiv.org/abs/2401.14626 ,Towards Lifelong Scene Graph Generation with Knowledge-ware In-context Prompt Learning,"Tao He, Tongtong Wu, Dongyang Zhang, Guiduo Duan, Ke Qin, Yuan-Fang Li","SGG(장면 그래프 생성)는 이미지 내 개체 쌍 간의 시각적 관계를 예측하려고 노력합니다. 널리 사용되는 SGG 방법은 전통적으로 SGG에 대한 일회성 학습 프로세스를 가정합니다. 이러한 기존 패러다임에서는 새로운 관계가 나타날 때마다 이전에 관찰한 모든 샘플에 대해 반복적인 훈련이 필요할 수 있으므로 이전에 획득한 지식을 잊어버릴 위험이 완화됩니다. 이 작업은 이전 관계 예측 모음에 내재된 이러한 함정을 해결하려고 합니다. 사전 훈련된 언어 모델의 상황 내 학습 성과에 동기를 부여받은 우리의 접근 방식은 치명적인 망각에 굴복하지 않고 관계를 예측하고 지속적으로 새로운 지식을 획득할 수 있는 기능을 모델에 부여합니다. 이 목표를 달성하기 위해 우리는 조건자 같은 작업이 스트리밍 방식으로 전개되는 평생 장면 그래프 생성(LSGG)이라는 장면 그래프 생성을 위한 새롭고 실용적인 프레임워크를 소개합니다. 이 프레임워크에서 모델은 제한된 수의 예시를 제외하고 이전에 접한 학습 데이터에 대한 액세스가 없는 현재 작업에 대한 배타적 학습으로 제한되지만, 모델은 지금까지 접한 모든 조건자를 추론하는 작업을 맡습니다. 엄격한 실험은 다양한 측정 항목에 걸쳐 LSGG의 맥락에서 최첨단 SGG 모델에 비해 우리가 제안한 방법의 우월성을 보여줍니다. 게다가 두 가지 주류 벤치마크 데이터 세트인 VG와 Open-Image(v6)에 대한 광범위한 실험은 지속적인 학습 및 기존 설정 측면에서 제안된 모델이 여러 경쟁 SGG 모델보다 우수함을 보여줍니다. 또한 포괄적인 절제 실험은 모델의 각 구성 요소의 효율성을 보여줍니다."
533,http://arxiv.org/abs/2401.14111 ,Image Synthesis with Graph Conditioning: CLIP-Guided Diffusion Models for Scene Graphs,"Rameshwar Mishra, A V Subramanyam",생성 모델의 발전으로 인해 특정 구조 지침을 준수하면서 이미지를 생성하는 데 상당한 관심이 촉발되었습니다. 장면 그래프에서 이미지 생성까지의 작업은 주어진 장면 그래프와 일치하는 이미지를 생성하는 작업 중 하나입니다. 그러나 시각적 장면의 복잡성으로 인해 장면 그래프 내에서 지정된 관계를 기반으로 개체를 정확하게 정렬하는 데 어려움이 있습니다. 기존 방법은 먼저 장면 레이아웃을 예측하고 적대적 훈련을 사용하여 이러한 레이아웃에서 이미지를 생성함으로써 이 작업에 접근합니다. 이 작업에서는 중간 레이아웃을 예측할 필요가 없는 장면 그래프에서 이미지를 생성하는 새로운 접근 방식을 소개합니다. 사전 훈련된 텍스트-이미지 확산 모델과 CLIP 지침을 활용하여 그래프 지식을 이미지로 변환합니다. 이를 위해 먼저 GAN 기반 학습을 사용하여 그래프 특징을 해당 이미지의 CLIP 특징과 정렬하도록 그래프 인코더를 사전 학습합니다. 또한 그래프 기능을 주어진 장면 그래프에 있는 객체 레이블의 CLIP 임베딩과 융합하여 그래프와 일관된 CLIP 안내 조건 신호를 생성합니다. 조건 입력에서 객체 임베딩은 이미지의 대략적인 구조를 제공하고 그래프 기능은 객체 간의 관계를 기반으로 구조적 정렬을 제공합니다. 마지막으로 재구성 및 CLIP 정렬 손실이 있는 그래프 일치 조건화 신호를 사용하여 사전 훈련된 확산 모델을 미세 조정합니다. 정교한 실험에 따르면 우리의 방법은 COCO 항목 및 Visual Genome 데이터 세트의 표준 벤치마크에서 기존 방법보다 성능이 뛰어난 것으로 나타났습니다.
532,http://arxiv.org/abs/2401.12835 ,SGTR+: End-to-end Scene Graph Generation with Transformer,"Rongjie Li, Songyang Zhang, Xuming He","장면 그래프 생성(SGG)은 구성 특성으로 인해 여전히 어려운 시각적 이해 작업으로 남아 있습니다. 대부분의 이전 작업은 상향식, 2단계 또는 포인트 기반, 1단계 접근 방식을 채택했는데, 이는 종종 시간 복잡성이 높거나 최적이 아닌 설계로 인해 어려움을 겪습니다. 본 연구에서는 앞서 언급한 문제를 해결하기 위한 새로운 SGG 방법을 제안하고 작업을 이분 그래프 구성 문제로 공식화합니다. 위의 문제를 해결하기 위해 변환기 기반 엔드투엔드 프레임워크를 생성하여 엔터티 및 엔터티 인식 조건자 제안 세트를 생성하고 방향성 에지를 추론하여 관계 삼중항을 형성합니다. 또한, 엔터티 인식 구조를 기반으로 이분 장면 그래프의 연결성을 추론하는 그래프 조립 모듈을 설계하여 엔드 투 엔드 방식으로 장면 그래프를 생성할 수 있습니다. 이분 그래프 조립 패러다임을 기반으로 우리는 엔터티 인식 모델링의 효율성과 그래프 조립의 최적화 안정성을 해결하기 위한 새로운 기술 설계를 추가로 제안합니다. 향상된 엔터티 인식 설계를 갖춘 우리의 방법은 최적의 성능과 시간 복잡성을 달성합니다. 광범위한 실험 결과에 따르면 우리의 설계는 세 가지 까다로운 벤치마크에서 최첨단 또는 이에 필적하는 성능을 달성하여 기존 접근 방식의 대부분을 능가하고 추론에서 더 높은 효율성을 누릴 수 있음을 보여줍니다. 코드는 https://github.com/Scarecrow0/SGTR에서 확인할 수 있습니다."
531,http://arxiv.org/abs/2401.12479 ,TD^2-Net: Toward Denoising and Debiasing for Dynamic Scene Graph Generation,"Xin Lin, Chong Shi, Yibing Zhan, Zuopeng Yang, Yaqi Wu, Dacheng Tao","동적 장면 그래프 생성(SGG)은 비디오에서 객체를 감지하고 해당 객체의 쌍 관계를 결정하는 데 중점을 둡니다. 기존 동적 SGG 방법은 일반적으로 1) 일부 프레임에 가려지거나 흐릿한 개체가 포함될 수 있으므로 상황에 따른 노이즈를 비롯한 여러 문제로 인해 어려움을 겪습니다. 2) 라벨 편향. 주로 소수의 긍정적인 관계 샘플과 다수의 부정적인 관계 샘플 사이의 높은 불균형으로 인해 발생합니다. 또한 관계 분포는 긴 꼬리 패턴을 나타냅니다. 위의 문제를 해결하기 위해 본 논문에서는 동적 SGG에 대한 잡음 제거 및 편향 제거를 목표로 하는 TD$^2$-Net이라는 네트워크를 소개합니다. 구체적으로, 우리는 먼저 강력한 상황 정보로 객체 표현을 향상시키는 잡음 제거 시공간 변환기 모듈을 제안합니다. 이는 각 객체에 대한 관련 이웃을 선택하기 위해 gumbel-softmax 샘플링 전략을 활용하는 미분 가능한 Top-K 객체 선택기를 설계함으로써 달성됩니다. 둘째, 라벨 편향 문제를 완화하기 위해 비대칭 재가중 손실을 도입합니다. 이 손실 함수는 비대칭 초점 요소와 샘플 볼륨을 통합하여 개별 샘플에 할당된 가중치를 조정합니다. 체계적인 실험 결과는 Action Genome 데이터베이스에 대한 기존의 최첨단 접근 방식보다 우리가 제안한 TD$^2$-Net의 우수성을 보여줍니다. 더 자세히 살펴보면, TD$^2$-Net은 조건자 분류에 대한 평균-Recall@10에서 2위 경쟁사보다 12.7\% 더 나은 성능을 보입니다."
530,http://arxiv.org/abs/2401.09786 ,Adaptive Self-training Framework for Fine-grained Scene Graph Generation,"Kibum Kim, Kanghoon Yoon, Yeonjun In, Jinyoung Moon, Donghyun Kim, Chanyoung Park",SGG(장면 그래프 생성) 모델은 긴 꼬리 조건자 분포 및 주석 누락 문제와 같은 벤치마크 데이터 세트와 관련된 고유한 문제로 어려움을 겪었습니다. 본 연구에서는 주석이 없는 삼중항을 활용하여 SGG의 긴 꼬리 문제를 완화하는 것을 목표로 합니다. 이를 위해 SGG 모델이 훈련되는 기반으로 주석이 없는 삼중항에 의사 레이블을 할당하는 SGG용 자체 훈련 프레임워크(ST-SGG)를 소개합니다. 이미지 인식을 위한 자체 학습에서 상당한 진전이 있었지만 SGG 작업을 위한 자체 학습 프레임워크를 설계하는 것은 의미적 모호성 및 조건자 클래스의 긴 꼬리 분포와 같은 고유한 특성으로 인해 더욱 어렵습니다. 따라서 우리는 기존 SGG 모델에 적용할 수 있는 모델 독립적 프레임워크인 CATM(Class-Specific Adaptive Thresholding with Momentum)이라는 SGG를 위한 새로운 의사 라벨링 기술을 제안합니다. 또한 제안된 자체 학습 프레임워크를 MPNN(메시지 전달 신경망) 기반 SGG 모델에 적용할 때 유용한 그래프 구조 학습기(GSL)를 고안했습니다. 우리의 광범위한 실험은 특히 세분화된 조건자 클래스의 성능을 향상시키는 데 있어 다양한 SGG 모델에서 ST-SGG의 효율성을 검증합니다.
529,http://arxiv.org/abs/2401.09340 ,SceneVerse: Scaling 3D Vision-Language Learning for Grounded Scene Understanding,"Baoxiong Jia, Yixin Chen, Huangyue Yu, Yan Wang, Xuesong Niu, Tengyu Liu, Qing Li, Siyuan Huang","언어를 3D 물리적 환경에 맞추는 데 초점을 맞춘 3D 비전 언어 접지는 구체화된 에이전트 개발의 초석입니다. 2D 영역의 최근 발전과 비교하여 3D 장면의 기반 언어는 몇 가지 중요한 과제에 직면해 있습니다. (i) 다양한 객체 구성, 풍부한 속성 및 복잡한 관계로 인한 3D 장면의 고유한 복잡성; (ii) 기초 학습을 지원하기 위한 쌍을 이루는 3D 비전-언어 데이터의 부족; (iii) 기반 3D 데이터에서 지식을 추출하기 위한 통합 학습 프레임워크가 부족합니다. 본 연구에서 우리는 실내 환경에서 3D 비전 언어 학습을 체계적으로 확대하는 잠재력을 조사함으로써 3D 비전 언어의 세 가지 주요 과제를 해결하는 것을 목표로 합니다. 우리는 약 68K 3D 실내 장면을 포함하고 인간 주석과 확장 가능한 장면 그래프 기반 생성 접근 방식에서 파생된 250만 개의 비전 언어 쌍으로 구성된 최초의 백만 규모 3D 비전 언어 데이터 세트인 SceneVerse를 소개합니다. 우리는 이러한 스케일링이 3D 비전 언어 학습을 위한 통합 사전 훈련 프레임워크인 GPS(Grounded Pre-training for Scenes)를 허용한다는 것을 보여줍니다. 광범위한 실험을 통해 기존의 모든 3D 시각적 접지 벤치마크에서 최첨단 성능을 달성하여 GPS의 효율성을 보여줍니다. SceneVerse 및 GPS의 엄청난 잠재력은 까다로운 3D 비전 언어 작업에서 제로샷 전송 실험을 통해 공개됩니다. 프로젝트 웹사이트: https://scene-verse.github.io."
528,http://arxiv.org/abs/2401.01130 ,Joint Generative Modeling of Grounded Scene Graphs and Images via Diffusion Models,"Bicheng Xu, Qi Yan, Renjie Liao, Lele Wang, Leonid Sigal","우리는 고차원, 다중 모드 구조 데이터와 관련된 어려운 작업인 이미지 생성이라는 공동 기반 장면 그래프를 위한 프레임워크를 소개합니다. 이 복잡한 결합 분포를 효과적으로 모델링하기 위해 우리는 인수분해 접근 방식을 채택했습니다. 먼저 접지 장면 그래프를 생성한 다음 생성된 접지 장면 그래프를 조건으로 이미지를 생성합니다. 조건부 이미지 생성은 문헌에서 널리 연구되었지만 우리의 주요 초점은 이미지 생성 프로세스에 대한 효율적이고 해석 가능한 제어를 제공하는 노이즈로부터 접지된 장면 그래프를 생성하는 것입니다. 이 작업에는 연속 속성(예: 객체 경계 상자)과 이산 속성(예: 객체 및 관계 범주)을 포함하는 노드(객체)와 가장자리(객체 간 관계) 모두에 대한 이질적인 속성이 있는 그럴듯한 기반 장면 그래프를 생성해야 합니다. 이러한 문제를 해결하기 위해 우리는 이종 노드와 에지 속성을 공동으로 모델링하는 새로운 확산 모델인 DiffuseSG를 소개합니다. 범주형 데이터를 효과적으로 처리하기 위해 다양한 인코딩 전략을 탐색합니다. 그래프 변환기를 노이즈 제거기로 활용하는 DiffuseSG는 구조화된 출력을 생성하기 위해 이산화하기 전에 연속 공간에서 접지된 장면 그래프 표현을 점진적으로 개선합니다. 또한 경험적 성능을 향상시키기 위해 IoU 기반 정규화 용어를 도입합니다. 우리 모델은 VG 및 COCO-Stuff 데이터 세트의 기본 장면 그래프 생성에서 기존 방법보다 성능이 뛰어나며 작업의 복잡성을 보다 정확하게 포착하는 표준 및 새로 도입된 측정 항목 모두에서 탁월합니다. 또한 우리는 두 가지 중요한 다운스트림 작업에서 DiffuseSG의 광범위한 적용 가능성을 보여줍니다. 1) 다양한 접지 장면 그래프 완성 작업에서 우수한 결과 달성, 2) DiffuseSG에서 생성된 추가 훈련 샘플을 활용하여 접지 장면 그래프 감지 모델 향상."
527,http://arxiv.org/abs/2312.17425 ,ALF: Adaptive Label Finetuning for Scene Graph Generation,"Qishen Chen, Jianzhi Liu, Xinyu Lyu, Lianli Gao, Heng Tao Shen, Jingkuan Song","SGG(장면 그래프 생성)는 주어진 이미지에서 피사체와 객체 간의 관계를 예측하려고 노력합니다. 그럼에도 불구하고 관계의 롱테일 분포는 종종 거친 레이블에 대한 편향된 예측으로 이어져 SGG에 상당한 장애물을 제시합니다. 이 문제를 해결하기 위해 연구자들은 편파적이지 않은 SGG에 중점을 두고 전체 데이터 세트에서 대략적인 조건부를 세분화된 조건부로 전송하는 데이터 전송 방법을 도입합니다. 그러나 이러한 방법은 두 가지 주요 문제에 직면합니다. 1) 주체-객체 쌍에 의해 부과된 고유한 컨텍스트 제약을 간과하여 잘못된 관계 전송을 초래합니다. 2) 데이터 전송 후 추가적인 재훈련 과정이 필요하며, 이로 인해 상당한 전산 비용이 발생합니다. 이러한 한계를 극복하기 위해 우리는 ALF(Adaptive Label Finetuning)라고 불리는 최초의 플러그 앤 플레이 1단계 데이터 전송 파이프라인을 SGG에 도입했습니다. 이 파이프라인은 추가 재교육 세션의 필요성을 없애고 동시에 다양한 SGG 벤치마크 접근 방식에서 모델의 관계 인식 기능을 크게 향상시킵니다. 특히 ALF는 적응형 레이블 구성(ALC)과 적응형 반복 학습(AIL)의 두 가지 구성 요소로 구성됩니다. ALC는 관계 공간 내에 Predicate-Context Constraints를 부과함으로써 제한 기반 판단 기술을 활용하는 모델의 예측 로짓을 참조하여 후보 관계의 순위를 다시 매기고 선택하여 강력한 관계 전송을 달성합니다. ALC에서 전송된 레이블을 감독하는 AIL은 자동 회귀 방식으로 SGG 모델을 반복적으로 미세 조정하여 재교육 프로세스에서 발생하는 상당한 계산 비용을 완화합니다. 광범위한 실험을 통해 ALF는 일반적인 SGG 방법인 Motif에 비해 mR@100이 16% 향상되었으며 최첨단 방법인 IETrans에 비해 계산 비용이 6%만 증가한 것으로 나타났습니다."
526,http://arxiv.org/abs/2312.13219 ,Interactive Visual Task Learning for Robots,"Weiwei Gu, Anant Sah, Nakul Gopalan","우리는 인간 사용자와의 현장 언어 상호 작용을 통해 로봇이 새로운 시각적 개념과 작업을 학습할 수 있는 프레임워크를 제시합니다. 이전 접근 방식에서는 사전 훈련된 대규모 시각적 모델을 사용하여 새로운 개체를 제로샷으로 추론하거나 개념 계층 구조에 속성 및 표현과 함께 새로운 개념을 추가했습니다. 우리는 새로운 개념을 배우고 보이지 않는 로봇 공학 작업을 해결할 수 있도록 함으로써 시각적 개념 계층 학습에 초점을 맞춘 접근 방식을 확장합니다. 시각적 개념 학습자가 로봇 공학 작업을 한 번에 해결할 수 있도록 하기 위해 우리는 두 가지 고유한 기술을 개발했습니다. 첫째, 개념 계층 내에서 상위 노드에 새로운 개념의 정보를 증가시키는 새로운 접근 방식인 Hi-Viscont(HIerarchical VISual CONcept learner for Task)를 제안합니다. 이러한 정보 전파를 통해 지속적인 학습 환경에서 새로운 개념을 가르칠 때 계층 구조의 모든 개념이 업데이트될 수 있습니다. 둘째, 시각적 작업을 언어 주석이 포함된 장면 그래프로 표현하여 현장에서 시연된 작업 제로 샷의 새로운 순열을 만들 수 있습니다. 우리는 두 가지 결과 세트를 제시합니다. 먼저, Hi-Viscont와 시각적 질의응답(VQA) 기준 모델(FALCON)을 세 가지 영역에서 비교합니다. Hi-Viscont는 리프 레벨 개념의 기본 모델과 비교되는 동시에 리프가 아닌 개념에서 평균 9% 이상의 개선을 달성합니다. 모델의 성능을 기본 FALCON 모델과 비교합니다. 우리의 프레임워크는 기본 모델에 비해 성공률 지표가 33% 향상되고 개체 수준 정확도가 19% 향상되었습니다. 이 두 결과를 통해 우리는 로봇의 지속적인 학습 환경에서 작업과 개념을 학습하는 모델의 능력을 보여줍니다."
525,http://arxiv.org/abs/2312.11713 ,Indoor and Outdoor 3D Scene Graph Generation via Language-Enabled Spatial Ontologies,"Jared Strader, Nathan Hughes, William Chen, Alberto Speranzon, Luca Carlone","본 논문에서는 임의의 실내 및 실외 환경에서 3D 장면 그래프를 구축하는 접근 방식을 제안합니다. 그러한 확장은 어려운 일입니다. 실외 환경을 설명하는 개념 계층은 실내보다 더 복잡하며 이러한 계층을 수동으로 정의하는 것은 시간이 많이 걸리고 확장되지 않습니다. 또한 훈련 데이터가 부족하여 실내 환경에서 사용되는 학습 기반 도구를 직접 적용하기가 어렵습니다. 이러한 문제를 해결하기 위해 우리는 두 가지 새로운 확장을 제안합니다. 첫째, 실내 및 실외 로봇 작동과 관련된 개념과 관계를 정의하는 공간 온톨로지를 구축하는 방법을 개발합니다. 특히 우리는 이러한 온톨로지를 구축하기 위해 LLM(Large Language Model)을 사용하므로 필요한 수동 작업의 양을 크게 줄입니다. 둘째, LTN(Logic Tensor Networks)을 사용하여 3D 장면 그래프 구성을 위한 공간 온톨로지를 활용하여 논리적 규칙 또는 공리(예: ""해변에 모래가 포함되어 있음"")를 추가합니다. 이는 훈련 시간에 추가 감독 신호를 제공하여 레이블이 지정된 데이터의 필요성을 줄이고 더 나은 예측을 제공하며 훈련 시간에 보이지 않는 개념 예측도 허용합니다. 우리는 실내, 시골 및 해안 환경을 포함한 다양한 데이터 세트에서 접근 방식을 테스트하고 주석이 거의 없는 데이터를 사용하여 3D 장면 그래프 생성의 품질을 크게 향상시키는 것으로 나타났습니다."
524,http://arxiv.org/abs/2312.10251 ,Advancing Surgical VQA with Scene Graph Knowledge,"Kun Yuan, Manasi Kattel, Joel L. Lavanchy, Nassir Navab, Vinkle Srivastav, Nicolas Padoy","현대의 수술실은 점점 더 복잡해지고 있으며 혁신적인 수술 내 지원 시스템이 필요합니다. 수술 데이터 과학의 초점은 주로 비디오 분석에 맞춰져 있지만, 수술 컴퓨터 비전과 언어 기능의 통합이 필수 사항으로 대두되고 있습니다. 우리의 작업은 장면 그래프 지식을 통해 수술 상황에서 시각적 질문 응답(VQA)을 발전시키는 것을 목표로 하며, 현재 수술 VQA 시스템의 두 가지 주요 과제를 해결합니다. 즉, 수술 VQA 데이터세트에서 질문 조건 편향을 제거하고 수술 VQA 모델 설계에 장면 인식 추론을 통합하는 것입니다. 먼저 공개적으로 사용 가능한 데이터 세트에 대한 분할 및 감지 모델을 사용하여 생성된 수술 장면 그래프 기반 데이터 세트 SSG-QA를 제안합니다. 기구와 해부체의 공간정보와 동작정보를 활용하여 수술 장면 그래프를 구축합니다. 이 그래프는 질문 엔진에 입력되어 다양한 QA 쌍을 생성합니다. SSG-QA 데이터세트는 기존 수술용 VQA 데이터세트에 비해 더 복잡하고, 다양하며, 기하학적으로 기반이 있고, 편파적이지 않은 수술 조치 중심의 데이터세트를 제공합니다. 그런 다음 텍스트와 장면 기능 간의 교차 주의를 사용하여 VQA 모델 설계에 기하학적 장면 지식을 통합하는 경량 장면 내장 상호 작용 모듈(SIM)을 통합한 새로운 외과용 VQA 모델인 SSG-QA-Net을 제안합니다. SSG-QA 데이터 세트에 대한 포괄적인 분석에 따르면 SSG-QA-Net은 다양한 질문 유형과 복잡성에 걸쳐 기존 방법보다 성능이 뛰어납니다. 우리는 현재 수술용 VQA 시스템의 주요 한계가 복잡한 질문에 답할 수 있는 현장 지식이 부족하다는 점을 강조합니다. 우리는 새로운 수술용 VQA 데이터세트와 모델을 제시하고 VQA 모델 디자인에 기하학적 장면 특징을 통합하면 결과가 크게 향상될 수 있음을 보여줍니다. 소스 코드와 데이터 세트는 https://github.com/CAMMA-public/SSG-QA에서 공개적으로 제공됩니다."
