no,arxiv_url,title,authors,abstract_kor
285,http://arxiv.org/abs/2205.11501 ,VQA-GNN: Reasoning with Multimodal Knowledge via Graph Neural Networks for Visual Question Answering,"Yanan Wang, Michihiro Yasunaga, Hongyu Ren, Shinya Wada, Jure Leskovec","시각적 질문 답변(VQA)에서는 시스템이 비구조적(예: 질문과 답변의 컨텍스트, ""QA 컨텍스트"") 및 구조화된(예: QA 컨텍스트 및 장면에 대한 지식 그래프, ""개념 그래프"") 다중 모드 지식을 통합하여 개념 수준 추론을 수행해야 합니다. 기존 작업은 일반적으로 해당 시각적 노드와 개념 노드를 연결하여 장면 그래프와 장면의 개념 그래프를 결합한 다음 QA 컨텍스트 표현을 통합하여 질문 답변을 수행합니다. 그러나 이러한 방법은 구조화되지 않은 지식에서 구조화된 지식으로 단방향 융합만 수행하므로 이질적인 지식 양식에 대한 공동 추론을 포착할 수 있는 잠재력이 제한됩니다. 보다 표현적인 추론을 수행하기 위해 우리는 통합된 지식 표현을 얻기 위해 비구조화된 다중 모드 지식과 구조화된 다중 모드 지식 간의 양방향 융합을 수행하는 새로운 VQA 모델인 VQA-GNN을 제안합니다. 구체적으로 QA 컨텍스트를 표현하는 슈퍼 노드를 통해 장면 그래프와 개념 그래프를 상호 연결하고, 양식 간 표현 격차를 완화하는 추론을 위한 모드 간 메시지 전달을 수행하는 새로운 다중 모드 GNN 기술을 도입합니다. 두 가지 까다로운 VQA 작업(VCR 및 GQA)에서 우리의 방법은 강력한 기준 VQA 방법보다 VCR(Q-AR)에서 3.2%, GQA에서 4.6% 더 우수하여 개념 수준 추론 수행에 강점이 있음을 나타냅니다. 절제 연구는 구조화되지 않은 다중 모드 지식과 구조화된 다중 모드 지식을 통합하는 데 있어 양방향 융합 및 다중 모드 GNN 방법의 효율성을 추가로 보여줍니다."
284,http://arxiv.org/abs/2205.08325 ,GraphMapper: Efficient Visual Navigation by Scene Graph Generation,"Zachary Seymour, Niluthpol Chowdhury Mithun, Han-Pang Chiu, Supun Samarasekera, Rakesh Kumar","장면에 있는 객체 간의 기하학적 관계를 이해하는 것은 인간과 자율 에이전트 모두 새로운 환경에서 탐색할 수 있도록 하는 핵심 기능입니다. 장면 토폴로지의 희박하고 통합된 표현을 통해 에이전트는 효율적으로 작업하여 환경을 이동하고, 환경 상태를 다른 사람과 전달하고, 다양한 다운스트림 작업에 표현을 활용할 수 있습니다. 이를 위해, 우리는 해당 환경을 탐색하는 방법을 동시에 학습함으로써 해당 환경의 3D 장면 그래프 표현을 축적하는 방법을 학습하도록 자율 에이전트를 훈련시키는 방법을 제안합니다. 우리는 우리의 접근 방식인 GraphMapper를 사용하면 비전 기반 시스템보다 환경과의 더 적은 상호 작용을 통해 효과적인 탐색 정책을 학습할 수 있음을 보여줍니다. 또한 GraphMapper는 기존 학습 기반 솔루션과 함께 작동하여 탐색 효율성을 높일 뿐만 아니라 향후 다른 작업에 유용한 중간 장면 표현을 생성하는 모듈식 장면 인코더 역할을 할 수 있음을 보여줍니다."
283,http://arxiv.org/abs/2205.07017 ,Importance Weighted Structure Learning for Scene Graph Generation,"Daqi Liu, Miroslaw Bober, Josef Kittler","장면 그래프 생성은 입력 이미지에 대해 시각적으로 기반이 되는 장면 그래프를 구성하여 객체와 그 관계를 명시적으로 모델링하는 것을 목표로 하는 구조화된 예측 작업입니다. 현재 메시지 전달 신경망 기반 평균 필드 변형 베이지안 방법론은 이러한 작업에 대한 유비쿼터스 솔루션이며, 여기서 변형 추론 목표는 종종 고전적인 증거 하한으로 가정됩니다. 그러나 이러한 느슨한 목적에서 추론된 변형 근사는 일반적으로 기본 사후를 과소평가하여 종종 열등한 생성 성능으로 이어집니다. 본 논문에서는 재매개변수화 가능한 Gumbel-Softmax 샘플러에서 추출한 여러 샘플에서 계산된 보다 엄격한 중요도 가중 하한을 사용하여 기본 로그 분할 함수를 근사화하는 것을 목표로 하는 새로운 중요도 가중 구조 학습 방법을 제안합니다. 결과적으로 제한된 변형 추론 작업을 해결하기 위해 일반적인 엔트로피 거울 하강 알고리즘이 적용됩니다. 제안된 방법은 널리 알려진 다양한 장면 그래프 생성 벤치마크에서 최고의 성능을 달성했습니다."
282,http://arxiv.org/abs/2205.04188 ,Joint learning of object graph and relation graph for visual question answering,"Hao Li, Xu Li, Belhal Karimi, Jie Chen, Mingming Sun","장면 그래프를 통해 시각적 질의응답(VQA)을 모델링하면 추론의 정확성과 해석성을 크게 향상시킬 수 있습니다. 그러나 기존 모델은 속성이나 관계가 포함된 복잡한 추론 질문에 대해 제대로 답변하지 못하여 그림 1(a)에서 잘못된 속성 선택 또는 관계 누락이 발생합니다. 이는 이들 모델이 관계 및 속성 정보를 무시하고 장면 그래프의 모든 정보의 균형을 맞추지 못하기 때문입니다. 본 논문에서는 다중 스케일 장면 그래프 정보를 적절하게 인코딩하여 균형 잡힌 표현을 얻을 수 있는 새로운 DM-GNN(Dual Message-Passing Enhanced Graph Neural Network)을 소개합니다. 구체적으로, 우리는 (i) 장면 그래프를 객체와 관계에 다양한 초점을 맞춘 두 개의 그래프로 변환합니다. 그런 다음 이를 인코딩하기 위한 이중 구조를 설계하여 관계의 가중치를 증가시킵니다. (ii) 인코더 출력을 속성 기능과 융합하여 속성의 가중치를 증가시킵니다. (iii) 객체, 관계 및 속성 간의 정보 전달을 향상시키기 위한 메시지 전달 메커니즘을 제안합니다. 우리는 GQA, VG, Motif-VG를 포함한 데이터 세트에 대한 광범위한 실험을 수행하고 새로운 수준의 기술을 달성합니다."
281,http://arxiv.org/abs/2205.02958 ,Scene Graph Expansion for Semantics-Guided Image Outpainting,"Chiao-An Yang, Cheng-Yo Tan, Wan-Cyuan Fan, Cheng-Fu Yang, Meng-Lin Wu, Yu-Chiang Frank Wang","본 논문에서는 의미론적으로 실용적인 콘텐츠를 생성하여 이미지를 완성하는 의미론 기반 이미지 아웃페인팅 작업을 다룹니다. 대부분의 기존 이미지 아웃페인팅 작업과 달리 장면 그래프 수준에서 이미지 의미를 이해하고 완성하여 위 작업에 접근합니다. 특히, 우리는 연관된 구조 정보를 모델링하기 위한 입력으로 노드와 에지 특징을 취하도록 설계된 SGT(Scene Graph Transformer)의 새로운 네트워크를 제안합니다. 그래프 기반 입력을 더 잘 이해하고 처리하기 위해 SGT는 노드 및 에지 수준 모두에서 기능 주의를 고유하게 수행합니다. 전자는 에지를 관계 정규화로 보는 반면, 후자는 주의 프로세스를 안내하기 위해 노드의 동시 발생을 관찰합니다. 우리는 레이아웃과 장면 그래프가 포함된 부분 입력 이미지가 주어지면 장면 그래프 확장과 전체 레이아웃으로의 변환에 SGT를 적용할 수 있음을 보여줍니다. 최첨단 레이아웃-이미지 변환 작업에 이어, 이미지 아웃페인팅 작업은 충분하고 실용적인 의미론을 도입하여 완료될 수 있습니다. MS-COCO 및 Visual Genome의 데이터 세트에 대해 광범위한 실험이 수행되어 제안된 SGT 및 아웃페인팅 프레임워크의 효율성을 정량적, 질적으로 확인합니다."
280,http://arxiv.org/abs/2205.01316 ,HL-Net: Heterophily Learning Network for Scene Graph Generation,"Xin Lin, Changxing Ding, Yibing Zhan, Zijian Li, Dacheng Tao","SGG(장면 그래프 생성)는 객체를 감지하고 이미지 내 쌍별 관계를 예측하는 것을 목표로 합니다. 현재 SGG 방법은 일반적으로 그래프 신경망(GNN)을 활용하여 객체/관계 간의 컨텍스트 정보를 획득합니다. 그러나 효율성에도 불구하고 현재 SGG 방법은 이종성을 무시하고 장면 그래프의 동질성만을 가정합니다. 이에 본 논문에서는 장면 그래프에서 객체/관계 간의 동질성과 이질성을 종합적으로 탐색하기 위한 새로운 이종성 학습 네트워크(HL-Net)를 제안합니다. 보다 구체적으로 HL-Net은 다음과 같이 구성됩니다. 1) 객체의 이종성과 동질성을 모두 활용하기 위해 다양한 계층의 정보를 적응적으로 통합하는 적응형 재가중 변환기 모듈; 2) 관계 표현을 개선하기 위해 이종애를 고려하여 관계 간의 연결을 효율적으로 탐색하는 관계 특성 전파 모듈; 3) 객체/관계 간의 이종성과 동질성을 더욱 구별하여 그래프에서 개선된 메시지 전달을 촉진하는 이종성을 인식하는 메시지 전달 방식. 우리는 VG(Visual Genome)와 OI(Open Images)라는 두 가지 공개 데이터 세트에 대해 광범위한 실험을 수행했습니다. 실험 결과는 우리가 제안한 HL-Net이 기존의 최첨단 접근 방식보다 우수함을 보여줍니다. 좀 더 자세히 살펴보면 HL-Net은 장면 그래프 분류에 대한 VG 데이터 세트에서 2.1$\%$, 최종 점수에 대한 IO 데이터 세트에서 1.2$\%$만큼 2위 경쟁사보다 우수한 성능을 보입니다. 코드는 https://github.com/siml3/HL-Net에서 확인할 수 있습니다."
279,http://arxiv.org/abs/2205.01297 ,RU-Net: Regularized Unrolling Network for Scene Graph Generation,"Xin Lin, Changxing Ding, Jing Zhang, Yibing Zhan, Dacheng Tao","SGG(장면 그래프 생성)는 객체를 감지하고 각 객체 쌍 간의 관계를 예측하는 것을 목표로 합니다. 기존 SGG 방법은 일반적으로 1) 그래프 신경망 기반 메시지 전달(GMP) 모듈이 가짜 노드 간 상관 관계에 민감하기 때문에 모호한 개체 표현, 2) 심각한 클래스 불균형 및 많은 수의 누락된 주석으로 인해 관계 예측의 다양성이 낮은 등 여러 문제를 겪고 있습니다. 두 가지 문제를 모두 해결하기 위해 본 논문에서는 정규화된 언롤링 네트워크(RU-Net)를 제안합니다. 먼저 언롤링 기법의 관점에서 GMP와 GLD(Graph Laplacian Denoising) 사이의 관계를 연구하여 GMP가 GLD의 솔버로 공식화될 수 있음을 결정합니다. 이러한 관찰을 바탕으로 우리는 언롤링된 메시지 전달 모듈을 제안하고 $\ell_p$ 기반 그래프 정규화를 도입하여 노드 간의 가짜 연결을 억제합니다. 둘째, 순위 최대화를 통해 관계의 예측 다양성을 촉진하는 그룹 다양성 향상 모듈을 제안합니다. 체계적인 실험은 RU-Net이 다양한 설정 및 측정 기준에서 효과적이라는 것을 보여줍니다. 또한 RU-Net은 VG, VRD 및 OI의 세 가지 인기 데이터베이스에서 새로운 최첨단 기술을 달성합니다. 코드는 https://github.com/siml3/RU-Net에서 확인할 수 있습니다."
278,http://arxiv.org/abs/2204.11143 ,Supplementing Missing Visions via Dialog for Scene Graph Generations,"Zhenghao Zhao, Ye Zhu, Xiaoguang Zhu, Yuzhang Shang, Yan Yan","대부분의 최신 AI 시스템은 입력된 시각적 데이터가 다양한 컴퓨터 비전 작업에서 경쟁력 있는 성능을 달성하기에 충분하다는 전제에 의존합니다. 그러나 고전적인 작업 설정은 다양한 이유(예: 제한된 보기 범위 및 폐색)로 인해 완전한 시각적 데이터에 액세스할 수 없는 까다롭지만 일반적인 실제 상황을 거의 고려하지 않습니다. 이를 위해 불완전한 시각적 입력 데이터가 있는 컴퓨터 비전 작업 설정을 조사합니다. 특히 다양한 수준의 시각적 데이터 누락이 있는 장면 그래프 생성(SGG) 작업을 입력으로 활용합니다. 시각적 입력이 부족하면 직관적으로 성능 저하가 발생하지만, 작업 목표를 더 잘 달성하기 위해 자연어 대화 상호 작용을 통해 누락된 비전을 보완할 것을 제안합니다. 우리는 대부분의 기존 모델과 공동으로 학습할 수 있는 모델 독립적인 SI-Dial(보충 대화형 대화 상자) 프레임워크를 설계하여 현재 AI 시스템에 자연 언어로 질문 답변 상호 작용 기능을 부여합니다. 우리는 여러 기준에 걸쳐 유망한 성능 향상을 달성함으로써 광범위한 실험과 분석을 통해 시각적 입력이 누락된 작업 설정의 타당성과 보충 정보 소스로서 제안된 대화 모듈의 효율성을 보여줍니다."
277,http://arxiv.org/abs/2204.08123 ,Non-Parallel Text Style Transfer with Self-Parallel Supervision,"Ruibo Liu, Chongyang Gao, Chenyan Jia, Guangxuan Xu, Soroush Vosoughi","기존 텍스트 스타일 전송 모델의 성능은 모델이 훈련되는 비병렬 데이터세트로 인해 심각하게 제한됩니다. 비병렬 데이터세트에서는 소스 스타일과 대상 스타일의 문장 사이에 직접적인 매핑이 존재하지 않습니다. 따라서 스타일 전달 모델은 훈련 중에 대상 문장에 대한 약한 감독만 받게 되며, 이로 인해 모델이 스타일 독립적인 정보를 너무 많이 버리거나 스타일 전달에 완전히 실패하게 되는 경우가 많습니다. 본 연구에서는 대규모 언어 모델을 기반으로 한 새로운 텍스트 스타일 전송 프레임워크인 LaMer를 제안합니다. LaMer는 먼저 장면 그래프를 사용하여 비병렬 데이터세트에서 대략적인 병렬식을 마이닝한 다음 MLE 교육을 사용하고 모방 학습 개선을 통해 데이터 내의 본질적인 병렬성을 활용합니다. 두 가지 벤치마크 작업(감정 및 형식 전송)과 새로 제안된 도전적인 작업(정치적 입장 전송)에서 우리 모델은 전송 정확성, 콘텐츠 보존 및 유창성에서 질적 향상을 달성합니다. 추가적인 경험적 및 인간적 평가는 우리 모델이 훈련을 더욱 효율적으로 만들 뿐만 아니라 이전 모델보다 더 읽기 쉽고 다양한 표현을 생성한다는 것을 보여줍니다."
276,http://arxiv.org/abs/2204.02597 ,Fine-Grained Predicates Learning for Scene Graph Generation,"Xinyu Lyu, Lianli Gao, Yuyu Guo, Zhou Zhao, Hao Huang, Heng Tao Shen, Jingkuan Song","현재 장면 그래프 생성 모델의 성능은 구별하기 어려운 일부 조건자(예: ""여자가 위에 서 있음/해변을 걷고 있음"" 또는 ""여자가 근처에 있음/아이를 바라보고 있음"")로 인해 심각하게 저하됩니다. 일반 SGG 모델은 머리 술어를 예측하는 경향이 있고 기존 재조정 전략은 꼬리 범주를 선호하지만, 이들 중 어느 것도 구별하기 어려운 술어를 적절하게 처리할 수 없습니다. 이 문제를 해결하기 위해 구별하기 어려운 객체 클래스를 구별하는 데 초점을 맞춘 세분화된 이미지 분류에서 영감을 받아 장면 그래프 생성 작업을 위해 구별하기 어려운 조건자를 구별하는 것을 목표로 하는 FGPL(Fine-Grained Predicates Learning)이라는 방법을 제안합니다. 특히 SGG 모델이 세분화된 조건자 쌍을 파악하는 데 도움이 되는 조건자 격자(Predicate Lattice)를 먼저 소개합니다. 그런 다음 Predicate Lattice를 활용하여 인식 가능한 항목에 대해 학습된 판별력을 유지하면서 세분화된 술어를 구별하는 데 기여하는 Category Discriminating Loss 및 Entity Discriminating Loss를 제안합니다. 제안된 모델 독립적 전략은 술어 분류 하위 작업에서 평균 재현율(mR@100)의 22.8\%, 24.1\% 및 21.7\%만큼 세 가지 벤치마크 모델(Transformer, VCTree 및 Motif)의 성능을 각각 크게 향상시킵니다. 또한 우리 모델은 Visual Genome 데이터 세트에서 최첨단 방법보다 큰 차이(예: 평균 재현율(mR@100)의 6.1\%, 4.6\% 및 3.2\%)로 성능이 뛰어납니다."
275,http://arxiv.org/abs/2204.02380 ,CLEVR-X: A Visual Reasoning Dataset for Natural Language Explanations,"Leonard Salewski, A. Sophia Koepke, Hendrik P. A. Lensch, Zeynep Akata",VQA(Visual Question Answering)의 맥락에서 설명을 제공하는 것은 머신러닝의 근본적인 문제를 제시합니다. VQA에 대한 자연어 설명을 생성하는 프로세스에 대한 자세한 통찰력을 얻기 위해 CLEVR 데이터세트를 자연어 설명으로 확장하는 대규모 CLEVR-X 데이터세트를 소개합니다. CLEVR 데이터 세트의 각 이미지-질문 쌍에 대해 CLEVR-X에는 원본 장면 그래프에서 파생된 여러 구조화된 텍스트 설명이 포함되어 있습니다. 구성상 CLEVR-X 설명은 정확하며 주어진 질문에 대답하는 데 필요한 추론과 시각적 정보를 설명합니다. 우리는 제안된 데이터 세트의 실측 설명이 실제로 완전하고 관련성이 있는지 확인하기 위해 사용자 연구를 수행했습니다. 우리는 CLEVR-X 데이터세트의 두 가지 최첨단 프레임워크를 사용하여 VQA 맥락에서 자연어 설명을 생성하기 위한 기본 결과를 제시합니다. 또한 다양한 질문 및 답변 유형에 대한 설명 생성 품질에 대한 자세한 분석을 제공합니다. 또한 자연어 생성(NLG) 측정항목의 수렴에 대한 다양한 수의 실측 설명 사용이 미치는 영향을 연구합니다. CLEVR-X 데이터 세트는 \url{https://explainableml.github.io/CLEVR-X/}에서 공개적으로 제공됩니다.
274,http://arxiv.org/abs/2203.14260 ,Unsupervised Vision-Language Parsing: Seamlessly Bridging Visual Scene Graphs with Language Structures via Dependency Relationships,"Chao Lou, Wenjuan Han, Yuhuan Lin, Zilong Zheng","언어 설명과 함께 사실적인 시각적 장면 이미지를 이해하는 것은 일반적인 시각적 이해를 위한 기본 작업입니다. 이전 연구에서는 시각적 장면(예: 장면 그래프)과 자연어(예: 종속성 트리)에 대한 계층 구조를 개별적으로 구축하여 강력하고 포괄적인 결과를 보여주었습니다. 그러나 공동 비전 언어(VL) 구조를 구성하는 방법은 거의 연구되지 않았습니다. 더 도전적이지만 가치 있는, ​​우리는 감독되지 않은 방식으로 이러한 공동 VL 구조를 유도하는 것을 목표로 하는 새로운 작업을 소개합니다. 우리의 목표는 시각적 장면 그래프와 언어적 종속성 트리를 원활하게 연결하는 것입니다. VL 구조 데이터가 부족하기 때문에 새로운 데이터 세트 VLParse를 구축하는 것부터 시작합니다. 노동 집약적인 라벨링을 처음부터 사용하는 대신, 우리는 거친 구조를 생성하기 위한 자동 정렬 절차와 인간의 정제를 통해 고품질 구조를 생성하는 방법을 제안합니다. 또한 Vision-Language Graph Autoencoder의 약자인 대조 학습(CL) 기반 프레임워크 VLGAE를 제안하여 데이터 세트를 벤치마킹합니다. 우리 모델은 두 가지 파생 작업, 즉 언어 문법 유도 및 VL 구문 접지에서 우수한 성능을 얻습니다. 절제는 세분화된 VL 구조 구성에 대한 시각적 단서와 종속 관계 모두의 효율성을 보여줍니다."
273,http://arxiv.org/abs/2203.12849 ,Complex Scene Image Editing by Scene Graph Comprehension,"Zhongping Zhang, Huiwen He, Bryan A. Plummer, Zhenyu Liao, Huayan Wang","조건부 확산 모델은 텍스트 기반 의미 이미지 편집과 같은 다양한 작업에서 인상적인 성능을 보여주었습니다. 이전 작업에서는 이미지 영역을 인간 사용자가 수동으로 식별하거나 객체 중심 조작에만 잘 수행되는 객체 감지기를 사용해야 합니다. 예를 들어, 입력 이미지에 의미론적 의미가 동일한 여러 개체(예: 새 그룹)가 포함된 경우 개체 감지기는 대상 개체를 정확하게 조작하는 것은 물론이고 대상 개체를 인식하고 위치를 파악하는 데 어려움을 겪을 수 있습니다. 이러한 문제를 해결하기 위해 우리는 SGC-Net(Scene Graph Comprehension)을 통해 복잡한 장면 이미지 편집을 달성하기 위한 2단계 방법을 제안합니다. 첫 번째 단계에서는 장면 그래프를 사용하고 대상 객체의 위치를 ​​예측하는 RoI(관심 영역) 예측 네트워크를 훈련합니다. 객체 카테고리에만 기반한 객체 감지 방법과 달리, 우리의 방법은 복잡한 장면 내에서 객체와 의미 관계를 이해하여 대상 객체를 정확하게 인식할 수 있습니다. 두 번째 단계에서는 조건부 확산 모델을 사용하여 RoI 예측을 기반으로 이미지를 편집합니다. 우리는 CLEVR 및 Visual Genome 데이터 세트에 대한 접근 방식의 효율성을 평가합니다. 우리는 CLEVR의 SSIM에서 8포인트 개선을 보고했으며 편집된 이미지는 Visual Genome의 이전 작업보다 인간 사용자가 9~33% 더 선호하여 제안된 방법의 효율성을 검증했습니다. 코드는 github.com/Zhongping-Zhang/SGC_Net에서 확인할 수 있습니다."
272,http://arxiv.org/abs/2203.11937 ,4D-OR: Semantic Scene Graphs for OR Domain Modeling,"Ege Özsoy, Evin Pınar Örnek, Ulrich Eck, Tobias Czempiel, Federico Tombari, Nassir Navab","수술 절차는 다양한 행위자, 장치 및 상호 작용으로 구성된 매우 복잡한 수술실(OR)에서 수행됩니다. 현재까지 의학적으로 훈련받은 인간 전문가만이 이러한 까다로운 환경에서 모든 연결과 상호 작용을 이해할 수 있습니다. 이 문서는 커뮤니티가 OR 도메인의 자동화되고 전체적이며 의미론적인 이해와 모델링에 한 단계 더 가까워지도록 하는 것을 목표로 합니다. 이 목표를 위해 처음으로 SSG(의미론적 장면 그래프)를 사용하여 수술 장면을 설명하고 요약할 것을 제안합니다. 장면 그래프의 노드는 의료진, 환자, 의료 장비 등 방에 있는 다양한 행위자와 개체를 나타내고, 가장자리는 이들 간의 관계를 나타냅니다. 제안된 표현의 가능성을 검증하기 위해 우리는 실제 OR 시뮬레이션 센터에서 6개의 RGB-D 센서로 기록된 10개의 시뮬레이션된 전체 무릎 교체 수술을 포함하는 최초의 공개적으로 사용 가능한 4D 수술 SSG 데이터 세트인 4D-OR을 생성했습니다. 4D-OR에는 6734개의 프레임이 포함되어 있으며 SSG, 인간 및 물체 포즈, 임상 역할에 대한 풍부한 주석이 달려 있습니다. 우리는 실제로 OR에서 의미론적 추론을 추론할 수 있는 0.75 매크로 F1의 성공률을 갖춘 종단 간 신경망 기반 SSG 생성 파이프라인을 제안합니다. 우리는 0.85 매크로 F1을 달성하는 임상 역할 예측 문제에 장면 그래프를 사용하여 장면 그래프의 표현력을 추가로 보여줍니다. 코드와 데이터 세트는 수락 시 제공됩니다."
271,http://arxiv.org/abs/2203.11654 ,Fine-Grained Scene Graph Generation with Data Transfer,"Ao Zhang, Yuan Yao, Qianyu Chen, Wei Ji, Zhiyuan Liu, Maosong Sun, Tat-Seng Chua","SGG(장면 그래프 생성)는 이미지에서 삼중항(주어, 술어, 목적어)을 추출하도록 설계되었습니다. 최근 작업은 SGG에서 꾸준한 진전을 이루었으며 높은 수준의 시각 및 언어 이해를 위한 유용한 도구를 제공합니다. 그러나 롱테일 분포 및 의미 모호성을 포함한 데이터 분포 문제로 인해 현재 SGG 모델의 예측은 자주 발생하지만 정보가 없는 몇 가지 조건부(예: on, at)로 붕괴되는 경향이 있으며, 이는 다운스트림 작업에서 이러한 모델의 실제 적용을 제한합니다. 위의 문제를 해결하기 위해 플러그 앤 플레이 방식으로 적용할 수 있고 1,807개의 조건자 클래스가 있는 대규모 SGG로 확장할 수 있는 새로운 내부 및 외부 데이터 전송(IETrans) 방법을 제안합니다. 우리의 IETrans는 모든 조건자에 대해 더 충분하고 일관된 주석을 제공하는 향상된 데이터 세트를 자동으로 생성하여 데이터 배포 문제를 완화하려고 합니다. Neural Motif 모델은 강화된 데이터 세트에 대한 교육을 통해 경쟁력 있는 마이크로 성능을 유지하면서 매크로 성능을 두 배로 늘립니다. 코드와 데이터는 https://github.com/waxnkw/IETrans-SGG.pytorch에서 공개적으로 제공됩니다."
